Cnpj,RazaoSocial,ValorMaximo,Periodicidade
62237649,CAROL DISTRIBUIDORA DE TITULOS E VALORES MOBILIARIOS LTDA.,0,-
68757681,SIMPAUL CORRETORA DE CAMBIO E VALORES MOBILIARIOS  S.A.,0,-
7202627,COOPERATIVA CENTRAL DE CRÉDITO RURAL COM INTERAÇÃO SOLIDÁRIA -  CRESOL CENTRAL BRASIL,0,-
5425526,COOPERATIVA DE CRÉDITO E ECONOMIA COM INTERAÇÃO SOLIDÁRIA - CRESOL DESENVOLVIMENTO,0,-
5419025,COOPERATIVA DE ECONOMIA E CREDITO MÚTUO DOS PROFESSORES ESTADUAIS DA REGIÃO METROPOLITANA DE PORTO ALEGRE - EDUCREDI,0,-
22724710,COOPERATIVA DE CRÉDITO CREDIVERTENTES LTDA. - SICOOB CREDIVERTENTES,0,-
47074323,SICOOB CREDICONSUMO - COOPERATIVA DE CRÉDITO,0,-
57647653,"COOPERATIVA DE CRÉDITO, POUPANÇA E INVESTIMENTO DA REGIÃO DAS FLORES, DAS ÁGUAS E DOS VENTOS SP - SICREDI FORÇA DOS VENTOS SP",0,-
65229254,COOPERATIVA DE CRÉDITO COOPACREDI LTDA. - SICOOB COOPACREDI,0,-
33615055,COOPERATIVA DE CRÉDITO DE LIVRE ADMISSÃO DE ANÁPOLIS E REGIÃO LTDA,0,-
8931800,"COOPERATIVA DE CRÉDITO DOS EMPREGADOS DA CBA ITAPISSUMA E EMPREGADOS DE EMPRESAS PRESTADORA DE SERVIÇOS INDUSTRIAIS, NO ESTADO DE PERNAMBUCO - CREDCOOPE",0,-
71698674,SICOOB UNIMAIS MANTIQUEIRA - COOPERATIVA DE CRÉDITO DE LIVRE ADMISSÃO,0,-
2338666,COOPERATIVA DE CRÉDITO DE LIVRE ADMISSÃO CREDIEMBRAPA LTDA - SICOOB.,0,-
3042597,"COOPERATIVA DE CRÉDITO, POUPANÇA E INVESTIMENTO DE CAMPO GRANDE E REGIÃO - SICREDI CAMPO GRANDE MS",0,-
82096447,CREDIBRF - COOPERATIVA DE CRÉDITO,0,-
9274232,STATE STREET BRASIL S.A. - BANCO COMERCIAL,0,-
87733770,"COOPERATIVA DE CRÉDITO, POUPANÇA E INVESTIMENTO CONEXÃO - SICREDI CONEXÃO",0,-
58229246,BRADESCO-KIRTON CORRETORA DE CÂMBIO S.A.,0,-
71392047,COOPERATIVA DE CRÉDITO MONTECREDI LTDA. - SICOOB MONTECREDI,0,-
37554441,COOPERATIVA DE CRÉDITO SICOOB UNI SUL MS,0,-
9605581,GOLDMAN SACHS DO BRASIL CORRETORA DE TÍTULOS E VALORES MOBILIÁRIOS S.A.,0,-
64293582,COOPERATIVA DE CRÉDITO DOS EMPREGADOS DO GRUPO VALLOUREC NO BRASIL - COOVALL LTDA.,0,-
4608925,CREDJUST - COOPERATIVA DE CRÉDITO MÚTUO DOS INTEGRANTES DA JUSTIÇA DO TRABALHO DA 13ª REGIÃO LTDA.,0,-
57563728,COOPERATIVA DE ECONOMIA E CRÉDITO MÚTUO DOS EMPREGADOS DAS EMPRESAS DO GRUPO ECONÔMICO RHODIA - CREDIRHODIA,0,-
4062902,OZ CORRETORA DE CÂMBIO S.A.,0,-
10348181,COOPERATIVA DE CRÉDITO DO VALE DO ITAJAÍ E LITORAL CATARINENSE - SICREDI VALE LITORAL SC,0,-
54037916,COOPERATIVA DE CREDITO CREDICITRUS,0,-
2309070,CREDISIS JICRED - COOPERATIVA DE CRÉDITO DE LIVRE ADMISSÃO JICRED,0,-
69720910,CCB BRASIL ARRENDAMENTO MERCANTIL S/A.,0,-
72257793,SICREDI CEARÁ - COOPERATIVA DE CRÉDITO DO ESTADO DO CEARÁ,0,-
27302181,COOPERATIVA DE CREDITO DOS SERVIDORES DA UNIVERSIDADE FEDERAL DO ESPIRITO SANTO,0,-
5863726,COOPERATIVA DE CRÉDITO E ECONOMIA COM INTERAÇÃO SOLIDÁRIA DO PLANALTO SERRA DO RIO GRANDE DO SUL - CRESOL PLANALTO SERRA,0,-
61182408,BANCO INVESTCRED UNIBANCO S.A.,0,-
62795257,"COOPERATIVA DE ECONOMIA E CRÉDITO MÚTUO DOS EMPREGADOS DA MONDELEZ BRASIL, PHILIP MORRIS BRASIL E K&S ALIMENTOS - SICOOB COOPMOND",0,-
79063574,"COOPERATIVA DE CRÉDITO, POUPANÇA E INVESTIMENTO DO NORTE DO PARANÁ E SUL DE SÃO PAULO - SICREDI NORTE SUL PR/SP",0,-
94968518,EFX CORRETORA DE CÂMBIO LTDA.,0,-
31872495,BANCO C6 S.A.,0,-
2206577,"LUIZACRED S.A. SOCIEDADE DE CRÉDITO, FINANCIAMENTO E INVESTIMENTO",0,-
2904138,COOPERATIVA DE CRÉDITO RURAL E ECONOMIA COM INTERAÇÃO SOLIDÁRIA DE ÁUREA - CRESOL ÁUREA,0,-
3012230,HIPERCARD BANCO MÚLTIPLO S.A.,0,-
30138226,COOPERATIVA DE ECONOMIA E CREDITO MUTUO DOS EMPREGADOS DA CIA DE ELETRICIDADE DO ESTADO DO RJ CREDICERJ LTDA,0,-
20155248,PARMETAL DISTRIBUIDORA DE TÍTULOS E VALORES MOBILIÁRIOS LTDA,0,-
5545390,"SICREDI COOMAMP - COOPERATIVA DE CRÉDITO DOS MEMBROS DE INSTITUIÇÕES PÚBLICAS DAS CARREIRAS JURÍDICAS E DOS SERVIDORES PÚBLICOS FEDERAIS, ESTADUAIS E MUNICIPAIS EM SÃO LUÍS/MA E MUNICÍPIOS CIRCUNVIZIN",0,-
1235921,COOPERATIVA DE CRÉDITO DOS SERVIDORES PÚBLICOS MUNICIPAIS DA GRANDE VITÓRIA/ES,0,-
5597773,CREDISIS CREDIBRÁS COOPERATIVA DE CRÉDITO E INVESTIMENTO DE LIVRE ADMISSÃO DO OESTE DE RONDÔNIA,0,-
73113243,"COOPERATIVA DE CRÉDITO, POUPANÇA E INVESTIMENTO DE ARARAQUARA E REGIÃO - SICREDI CENTRO NORTE SP",0,-
13293225,ÓRAMA DISTRIBUIDORA DE TÍTULOS E VALORES MOBILIÁRIOS S.A.,0,-
4894460,COOPERATIVA DE ECONOMIA E CRÉDITO MÚTUO DOS SERVIDORES DA JUSTIÇA DO ESTADO DE MINAS GERAIS LTDA. - SICOOB CREDJUS,0,-
87510475,COOPERATIVA DE CRÉDITO ROTA DAS TERRAS - SICREDI ROTA DAS TERRAS RS/MG,0,-
26960328,COOPERATIVA DE CRÉDITO DE LIVRE ADMISSÃO DO TOCANTINS LTDA,0,-
2819125,"UBS BRASIL CORRETORA DE CÂMBIO, TÍTULOS E VALORES MOBILIÁRIOS S.A.",0,-
815319,COOPERATIVA DE CRÉDITO SUL-SERRANA DO ESPÍRITO SANTO,0,-
806535,PLANNER CORRETORA DE VALORES S.A.,0,-
1566038,COOPERATIVA DE CRÉDITO DE LIVRE ADMISSÃO DE ASSOCIADOS DE MANAUS,0,-
87779625,COOPERATIVA DE CRÉDITO COOPERAÇÃO - SICREDI COOPERAÇÃO,0,-
37395399,COOPERATIVA DE CRÉDITO DE LIVRE ADMISSÃO CENTRO BRASILEIRA LTDA.,0,-
31804966,COOPERATIVA DE CRÉDITO COOPERMAIS - SICOOB COOPERMAIS,0,-
4388688,COOPERATIVA DE CRÉDITO SICOOB ENGECRED LTDA.,0,-
4572960,COOPERATIVA DE ECONOMIA E CRÉDITO MÚTUO DOS MILITARES ESTADUAIS DE SANTA CATARINA - CREDPOM,0,-
17772370,VIP'S CORRETORA DE CÂMBIO LTDA.,0,-
88099247,"COOPERATIVA DE CRÉDITO, POUPANÇA E INVESTIMENTO RAÍZES - SICREDI RAÍZES RS/SC/MG",0,-
75647891,BANCO CRÉDIT AGRICOLE BRASIL S.A.,0,-
42584318,CREDIT SUISSE (BRASIL) S.A. CORRETORA DE TÍTULOS E VALORES MOBILIÁRIOS,0,-
71677850,FRENTE CORRETORA DE CÂMBIO S.A.,0,-
33479023,BANCO CITIBANK S.A.,0,-
70116611,CENTRAL DAS COOPERATIVAS DE CRÉDITO DO NORDESTE - SICOOB CENTRAL NE,0,-
59109165,BANCO VOLKSWAGEN S.A.,0,-
97259253,COOPERATIVA E ECONOMIA E CRÉDITO MÚTUO DOS MÉDICOS DO PLANALTO MÉDIO DO RIO GRANDE DO SUL LTDA. - CREDISIS/CREDIPLAN,0,-
8055016,COOPERATIVA DE CRÉDITO E ECONOMIA COM INTERAÇÃO SOLIDÁRIA - CRESOL INTERAÇÃO,0,-
16721078,COOPERATIVA DE ECONOMIA E CRÉDITO MÚTUO DOS FUNCIONÁRIOS DA SECRETARIA DE ESTADO DA FAZENDA  DO ESTADO DE MINAS GERAIS E DE LIVRE ADMISSÃO LTDA - SICOOB COOPSEF,0,-
2197569,COOPERATIVA DE CRÉDITO CREDSAOPAULO - SICOOB CREDSAOPAULO,0,-
7509426,COOPERATIVA DE CRÉDITO E ECONOMIA COM INTERAÇÃO SOLIDÁRIA - CRESOL XANXERÊ,0,-
8850613,COOPERATIVA DE ECONOMIA E CRÉDITO MÚTUO DOS EMPREGADOS DA CENTRAIS ELÉTRICAS DE SANTA CATARINA - CREDELESC,0,-
71419600,COOPERATIVA DE CRÉDITO DE LIVRE ADMISSÃO DA REGIÃO DE FRUTAL LTDA.   SICOOB FRUTAL,0,-
33987793,BANCO DE INVESTIMENTOS CREDIT SUISSE (BRASIL) S.A.,0,-
3685335,COOPERATIVA DE ECONOMIA E CRÉDITO MÚTUO DOS EMPREGADOS DA UNIFI - CREDIUNIFI,0,-
30183111,TROCKA CORRETORA DE CAMBIO LTDA.,0,-
84974278,"COOPERATIVA DE CREDITO, POUPANCA E INVESTIMENTO IGUACU - SICREDI IGUACU PR/SC/SP",0,-
73092827,COOPERATIVA DE CRÉDITO MÚTUO DOS SERVIDORES DO MINISTERIO DA EDUCAÇÃO EM SÃO PAULO - COOPEMESP,0,-
8482873,COOPERATIVA DE CRÉDITO RURAL DO AGRESTE ALAGOANO - COOPERAGRE,0,-
184068,COOPERATIVA DE CRÉDITO UNICRED CENTRAL MULTIRREGIONAL LTDA. - UCM,0,-
62169875,NU INVEST CORRETORA DE VALORES S.A.,0,-
81011686,COOPERATIVA DE CRÉDITO DO NORTE CATARINENSE E SUL PARANAENSE - SICOOB CREDINORTE,0,-
64739121,SICOOB CRED COPERCANA COOPERATIVA DE CRÉDITO,0,-
32430233,COOPERATIVA DE CRÉDITO CONEXÃO - SICOOB CONEXÃO,0,-
81115149,"COOPERATIVA DE CRÉDITO, POUPANÇA E INVESTIMENTO GRANDES LAGOS DO PARANÁ E LITORAL PAULISTA - SICREDI GRANDES LAGOS PR/SP",0,-
32206435,SUL AMERICA INVESTIMENTOS DISTRIBUIDORA DE TITULOS E VALORES MOBILIARIOS S.A.,0,-
5463212,COOPERATIVA CENTRAL DE CRÉDITO - AILOS,0,-
41753500,COOPERATIVA DE CRÉDITO CARLOS CHAGAS LTDA. - SICOOB CARLOS CHAGAS,0,-
4913129,CONFIDENCE CORRETORA DE CÂMBIO S.A.,0,-
3222753,CREDISIS CREDIARI - COOPERATIVA DE CRÉDITO LTDA.,0,-
61809182,CREDIT SUISSE HEDGING-GRIFFO CORRETORA DE VALORES S.A,0,-
15213150,BOCOM BBM CORRETORA DE CÂMBIO E VALORES MOBILIÁRIOS S.A.,0,-
36588217,WISE BRASIL CORRETORA DE CÂMBIO LTDA,0,-
25798596,COOPERATIVA DE CRÉDITO CREDIVAR LTDA. - SICOOB CREDIVAR,0,-
81466286,"COOPERATIVA DE CRÉDITO, POUPANÇA E INVESTIMENTO CAMPOS GERAIS E GRANDE CURITIBA - SICREDI CAMPOS GERAIS E GRANDE CURITIBA PR/SP",0,-
34829992,REAG DISTRIBUIDORA DE TÍTULOS E VALORES MOBILIÁRIOS S.A.,0,-
997804,BTG PACTUAL ADVISORS DISTRIBUIDORA DE TÍTULOS E VALORES MOBILIÁRIOS S.A.,0,-
76059997,"COOPERATIVA DE CRÉDITO, POUPANÇA E INVESTIMENTO PROGRESSO - SICREDI PROGRESSO PR/SP",0,-
18340695,COOPERATIVA DE ECONOMIA E CRÉDITO MÚTUO DOS EMPREGADOS DA INDÚSTRIA DE PAPÉIS SUDESTE LTDA . - CREDESTE,0,-
35470647,HEDGEPOINT GLOBAL MARKETS DISTRIBUIDORA DE TITULOS E VALORES MOBILIÁRIOS LTDA.,0,-
42107706,COOPERATIVA DE ECONOMIA E CREDITO MUTUO DOS EMPREGADOS DE ELEVADORES ATLAS SCHINDLER LTDA.,0,-
4995006,COOPESTADO - COOPERATIVA DE ECONOMIA E CRÉDITO MÚTUO DOS SERVIDORES PÚBLICOS NA REGIÃO METROPOLITANA DO ESTADO DO RIO DE JANEIRO LIMITADA,0,-
19307785,BRAZA BANK S.A. BANCO DE CÂMBIO,0,-
3793242,"COOPERATIVA DE CRÉDITO, POUPANÇA E INVESTIMENTO DO SUL DO ESTADO DE SANTA CATARINA - SICREDI SUL SC",0,-
87784088,"COOPERATIVA DE CRÉDITO, POUPANÇA E INVESTIMENTO SUL MINAS DO RIO GRANDE DO SUL E MINAS GERAIS - SICREDI SUL MINAS RS/MG.",0,-
85291086,COOPERATIVA DE CRÉDITO LITORÂNEA,0,-
45246410,BANCO GENIAL S.A.,0,-
89049738,"COOPERATIVA DE CRÉDITO, POUPANÇA E INVESTIMENTO NOROESTE RS/MG - SICREDI NOROESTE RS/MG",0,-
13486793,BRL TRUST DISTRIBUIDORA DE TÍTULOS E VALORES MOBILIÁRIOS S.A.,0,-
1023570,BANCO RABOBANK INTERNATIONAL BRASIL S.A.,0,-
67096909,COOPERATIVA DE CRÉDITO CREDICOCAPEC,0,-
48172860,COOPERATIVA DE ECONOMIA E CRÉDITO MÚTUO DOS FUNCIONÁRIOS DA OWENS CORNING FIBERGLAS AMÉRICA DO SUL,0,-
2347114,GREENCRED - COOPERATIVA DE CREDITO,0,-
79457883,COOPERATIVA DE CRÉDITO E INVESTIMENTO DE LIVRE ADMISSÃO AGROEMPRESARIAL - SICREDI AGROEMPRESARIAL PR/SP,0,-
61384004,AVENUE SECURITIES DISTRIBUIDORA DE TÍTULOS E VALORES MOBILIÁRIOS LTDA.,0,-
88043187,COOPERATIVA DE ECONOMIA E CRÉDITO MÚTUO DOS EMPREGADOS DA PROLEC GE BRASIL TRANSMISSÃO DE ENERGIA S.A.,0,-
7599206,COOPERATIVA DE CRÉDITO DE LIVRE ADMISSÃO DA REGIÃO METROPOLITANA DE GOIÂNIA LTDA.,0,-
10866788,BANCO BANDEPE S.A.,0,-
5222094,COOPERATIVA DE CRÉDITO DE LIVRE ADMISSÃO DE PIRACANJUBA LTDA. - SICOOB CERRADO,0,-
95594941,"COOPERATIVA DE CRÉDITO, POUPANÇA E INVESTIMENTO DAS REGIÕES CENTRO DO RS E MG - SICREDI REGIÃO CENTRO RS/MG",0,-
20251847,SUDACRED - SOCIEDADE DE CRÉDITO AO MICROEMPREENDEDOR E À EMPRESA DE PEQUENO PORTE LTDA.,0,-
15163587,DESENBAHIA - AGENCIA DE FOMENTO DO ESTADO DA BAHIA S.A.,0,-
1181521,BANCO COOPERATIVO SICREDI S.A.,0,-
43774196,"AGROLEND SOCIEDADE DE CREDITO, FINANCIAMENTO E INVESTIMENTO S.A.",0,-
1439107,BARRACRED - COOPERATIVA DE ECONOMIA E CRÉDITO MÚTUO,0,-
29341260,COOPERATIVA DE ECONOMIA E CREDITO MUTUO DOS SERVIDORES DA COMLURB LTDA,0,-
2723075,COOPSERJ - COOPERATIVA DE CRÉDITO MÚTUO DOS SERVIDORES PÚBLICOS DO PODER EXECUTIVO DO ESTADO DO RIO DE JANEIRO LTDA.,0,-
5410056,COOPERATIVA DE CRÉDITO E ECONOMIA COM INTERAÇÃO SOLIDÁRIA - CRESOL JAGUARUNA,0,-
30586895,COOPERATIVA DE ECONOMIA E CREDITO MUTUO DOS EMPREGADOS DOS LABORATORIOS B.BRAUN LTDA,0,-
4138455,COOPERATIVA DE CRÉDITO DO RIO GRANDE DO NORTE - SICOOB RIO GRANDE DO NORTE,0,-
26408161,"COOPERATIVA DE CRÉDITO, POUPANÇA E INVESTIMENTO DO CENTRO SUL DO MATO GROSSO DO SUL - SICREDI CENTRO-SUL MS",0,-
82527557,"COOPERATIVA DE CRÉDITO, POUPANÇA E INVESTIMENTO FRONTEIRAS DO PARANÁ, SANTA CATARINA E SÃO PAULO - SICREDI FRONTEIRAS PR/SC/SP",0,-
33737818,"COOPERATIVA CENTRAL DE CRÉDITO, POUPANÇA E INVESTIMENTO DE MATO GROSSO DO SUL, GOIÁS, DISTRITO FEDERAL E TOCANTINS - CENTRAL SICREDI BRASIL CENTRAL",0,-
3212823,"COOPERATIVA DE CRÉDITO, POUPANÇA E INVESTIMENTO DOS MILITARES ESTADUAIS E SERVIDORES DA SEGURANÇA DO ESTADO DO RIO GRANDE DO SUL - SICREDI MIL RS",0,-
70241658,"SICREDI RECIFE - COOPERATIVA DE CRÉDITO, POUPANÇA E INVESTIMENTO SICREDI RECIFE",0,-
62421979,BANCO CIFRA S.A.,0,-
80230774,"COOPERATIVA CENTRAL DE CRÉDITO, POUPANÇA E INVESTIMENTO DOS ESTADOS DO PARANÁ, SÃO PAULO E RIO DE JANEIRO - CENTRAL SICREDI PR/SP/RJ",0,-
53623781,COOPERATIVA DE CRÉDITO COOPCRED,0,-
90400888,BANCO SANTANDER (BRASIL) S.A.,0,-
3000142,"COOPERATIVA DE CRÉDITO, POUPANÇA E INVESTIMENTO DOS POLICIAIS FEDERAIS DO RIO GRANDE DO SUL E SANTA CATARINA - SICREDI POL RS/SC",0,-
78414067,"COOPERATIVA DE CRÉDITO, POUPANÇA E INVESTIMENTO VANGUARDA - SICREDI VANGUARDA PR/SP/RJ",0,-
3918382,AGENCIA DE FOMENTO DE GOIAS S/A,0,-
39343350,LAR COOPERATIVA DE CRÉDITO - LAR CREDI,0,-
35571249,"COOPERATIVA DE CRÉDITO, POUPANÇA E INVESTIMENTO SICREDI EVOLUÇÃO - SICREDI EVOLUÇÃO",0,-
71328769,SICOOB COCRED COOPERATIVA DE CRÉDITO,0,-
32615247,COOPERATIVA DE CREDITO SICOOB COOPEC LTDA.,0,-
9343038,COOPERATIVA DE CRÉDITO SICREDI ALTO SERTÃO PARAIBANO - SICREDI ALTO SERTÃO PARAIBANO,0,-
88038260,"COOPERATIVA DE CRÉDITO, POUPANÇA E INVESTIMENTO PLANALTO - SICREDI PLANALTO RS/MG",0,-
4715685,COOPERATIVA DE CRÉDITO MÚTUO DOS DESPACHANTES DE TRÂNSITO DE SANTA CATARINA E RIO GRANDE DO SUL - SICOOB CREDITRAN,0,-
62285390,SINGULARE CORRETORA DE TÍTULOS E VALORES MOBILIÁRIOS S.A.,0,-
60701190,ITAÚ UNIBANCO S.A.,0,-
78157146,CREDIALIANÇA COOPERATIVA DE CRÉDITO RURAL,0,-
81706616,"COOPERATIVA DE CRÉDITO, POUPANÇA E INVESTIMENTO VALOR SUSTENTÁVEL - SICREDI VALOR SUSTENTÁVEL PR/SP",0,-
25626490,"COOPERATIVA DE CRÉDITO, POUPANÇA E INVESTIMENTO ALTO RIO GRANDE MG - SICREDI CREDIGRANDE MG",0,-
4525997,"COOPERATIVA DE CRÉDITO, POUPANÇA E INVESTIMENTO DOS PROFESSORES, FUNCIONÁRIOS E ALUNOS DA UNIVERSIDADE DE CAXIAS DO SUL - SICREDI COOPERUCS",0,-
87853206,"COOPERATIVA DE CRÉDITO, POUPANÇA E INVESTIMENTO OURO BRANCO - SICREDI OURO BRANCO RS/MG",0,-
3662047,"COOPERATIVA DE CRÉDITO, POUPANÇA E INVESTIMENTO DAS CARREIRAS DO MINISTÉRIO PÚBLICO, TRIBUNAL DE CONTAS E SECRETARIA DA FAZENDA DO RIO GRANDE DO SUL - SICREDI MP RS",0,-
62284385,COOPERATIVA DE ECONOMIA E CRÉDITO MÚTUO DOS EMPREGADOS DO GRUPO SCHAEFFLER,0,-
4484490,COOPERATIVA DE CRÉDITO POUPANÇA E INVESTIMENTO DA ALTA NOROESTE DE SÃO PAULO - SICREDI ALTA NOROESTE SP,0,-
33657248,BANCO NACIONAL DE DESENVOLVIMENTO ECONOMICO E SOCIAL,0,-
44469161,COOPECREDI GUARIBA - COOPERATIVA DE CREDITO,0,-
4257795,NOVA FUTURA CORRETORA DE TÍTULOS E VALORES MOBILIÁRIOS LTDA.,0,-
83315408,SICREDI NORTE - COOPERATIVA DE CRÉDITO,0,-
18310649,COOPERATIVA DE ECONOMIA E CRÉDITO MÚTUO DOS SERVIDORES PÚBLICOS MUNICIPAIS EM JOÃO MONLEVADE LTDA. - COPREMON,0,-
2685483,"CM CAPITAL MARKETS CORRETORA DE CÂMBIO, TÍTULOS E VALORES MOBILIÁRIOS LTDA",0,-
4463602,"COOPERATIVA DE CRÉDITO, POUPANÇA E INVESTIMENTO DA REGIÃO CENTRO OESTE PAULISTA - SICREDI CENTRO OESTE PAULISTA",0,-
4853988,"COOPERATIVA DE CRÉDITO, POUPANÇA E INVESTIMENTO BANDEIRANTES - SICREDI BANDEIRANTES SP",0,-
5220243,COOPERATIVA DE CRÉDITO E INVESTIMENTO COM INTERAÇÃO SOLIDÁRIA ORIGENS - CRESOL ORIGENS,0,-
27171974,COOPERÁGUIA - COOPERATIVA DE ECONOMIA E CRÉDITO MÚTUO DOS EMPREGADOS DO GRUPO ÁGUIA BRANCA,0,-
9033698,COOPERATIVA DE CRÉDITO DE LIVRE ADMISSÃO DE RIO VERDE E REGIÃO LTDA.,0,-
14913919,COOPERATIVA DE CREDITO DO MERCADO IMOBILIÁRIO - SICOOB IMOB.VC,0,-
15227994,SIMPLIFIC PAVARINI DISTRIBUIDORA DE TÍTULOS E VALORES MOBILIÁRIOS LTDA,0,-
33923111,BRKB DISTRIBUIDORA DE TÍTULOS E VALORES MOBILIÁRIOS S.A.,0,-
804046,COOPERATIVA DE CRÉDITO CREDICAPI LTDA - SICOOB CREDICAPI,0,-
22610500,VORTX DISTRIBUIDORA DE TITULOS E VALORES MOBILIARIOS LTDA.,0,-
71884498,"COOPERATIVA DE CRÉDITO DOS MÉDICOS, DENTISTAS, PROFISSIONAIS DA ÁREA DE SAÚDE E DE LIVRE ADMISSÃO DO ESTADO DE SÃO PAULO LTDA. - UNICRED DO ESTADO DE SÃO PAULO",0,-
3603683,COOPERATIVA DE ECONOMIA E CRÉDITO MÚTUO DOS SERVIDORES PÚBLICOS - SICOOB COOPERPLAN CREDSEF,0,-
2671743,CM CAPITAL MARKETS DISTRIBUIDORA DE TÍTULOS E VALORES MOBILIÁRIOS LTDA,0,-
952415,COOPERATIVA DE CRÉDITO DE LIVRE ADMISSÃO CREDFAZ LTDA. - SICOOB CREDFAZ,0,-
6078926,"COOPERATIVA DE CRÉDITO, POUPANÇA E INVESTIMENTO DOS ESCRIVÃES, NOTÁRIOS E REGISTRADORES NO ESTADO DO PARANÁ - SICREDI CREDENOREG PR",0,-
53184438,COOPERATIVA DE ECONOMIA E CRÉDITO MÚTUO DOS COLABORADORES DA CEBRACE,0,-
1638542,SAFRA WEALTH DISTRIBUIDORA DE TÍTULOS E VALORES MOBILIÁRIOS LTDA.,0,-
5745533,COOPERATIVA DE CRÉDITO E ECONOMIA COM INTERAÇÃO SOLIDÁRIA DE ITATIBA DO SUL - CRESOL ITATIBA DO SUL,0,-
2137018,COOPERATIVA DE CRÉDITO DE LIVRE ADMISSÃO DE RORAIMA LTDA.,0,-
51489318,COOPERATIVA DE ECONOMIA E CRÉDITO MÚTUO DOS MAGISTRADOS DE SÃO PAULO - MAGISCRED,0,-
88530142,COOPERATIVA DE CRÉDITO E INVESTIMENTO LIBERDADE - SICREDI LIBERDADE,0,-
88471024,COOPERATIVA DE CRÉDITO CENTRO LESTE - SICREDI CENTRO LESTE RS,0,-
87900601,"COOPERATIVA DE CRÉDITO, POUPANÇA E INVESTIMENTO BOTUCARAÍ - SICREDI BOTUCARAÍ RS/MG",0,-
15489568,INTRA INVESTIMENTOS DISTRIBUIDORA DE TÍTULOS E VALORES MOBILIÁRIOS LTDA,0,-
65913436,GUIDE INVESTIMENTOS S.A. CORRETORA DE VALORES,0,-
37079720,COOPERATIVA DE CRÉDITO DE LIVRE ADMISSÃO LTDA. - SICOOB CREDIJUSTRA,0,-
90608712,COOPERATIVA DE CRÉDITO SICREDI SERRANA RS/ES,0,-
68742204,NUMBER ONE SOCIEDADE CORRETORA DE CAMBIO LTDA.,0,-
9516419,PICPAY BANK - BANCO MÚLTIPLO S.A,0,-