Cnpj,RazaoSocial,ValorMaximo,Periodicidade
556603,BANCO BARI DE INVESTIMENTOS E FINANCIAMENTOS S.A.,50000,Por evento
14511781,BARI COMPANHIA HIPOTECÁRIA,50000,Por evento
27214112,"AL5 S.A. CRÉDITO, FINANCIAMENTO E INVESTIMENTO",50000,Por evento
12599971,"CREDITÁ S/A CRÉDITO, FINANCIAMENTO E INVESTIMENTO",50000,Por evento
60850229,OMNI BANCO S.A.,20000,Por evento
795423,BANCO SEMEAR S.A.,20000,Por evento
20443996,"BECKER FINANCEIRA S.A. - CRÉDITO, FINANCIAMENTO E INVESTIMENTO",10000,Por evento
23511655,DEUTSCHE SPARKASSEN LEASING DO BRASIL BANCO MÚLTIPLO S.A.,10000,Por evento
80271455,BANCO RNX S.A.,10000,Por evento
9313766,"CARUANA S.A. - SOCIEDADE DE CRÉDITO, FINANCIAMENTO E INVESTIMENTO",10000,Por evento
62109566,CREDISAN COOPERATIVA DE CRÉDITO,7700,Por evento
4307598,FIDÚCIA SOCIEDADE DE CRÉDITO AO MICROEMPREENDEDOR E À EMPRESA DE PEQUENO PORTE LIMITADA.,6000,Por evento
4316357,SOCIALCRED S/A - SOCIEDADE DE CRÉDITO AO MICROEMPREENDEDOR E À EMPRESA DE PEQUENO PORTE,5000,Por evento
15581638,FACTA FINANCEIRA S.A. - CRÉDITO FINANCIAMENTO E INVESTIMENTO,5000,Por evento
61186680,BANCO BMG S.A.,5000,Por evento
2929977,AGENCIA DE FOMENTO DO AMAPA S.A.,4500,Por evento
92874270,BANCO DIGIMAIS S.A.,4000,Por evento
22639377,"SINOSSERRA FINANCEIRA S/A - SOCIEDADE DE CRÉDITO, FINANCIAMENTO E INVESTIMENTO",4000,Por evento
46570800,ALFA ARRENDAMENTO MERCANTIL S.A.,4000,Por evento
17167412,"FINANCEIRA ALFA S.A. - CREDITO, FINANCIAMENTO E INVESTIMENTOS",4000,Por evento
59118133,BANCO LUSO BRASILEIRO S.A.,4000,Por evento
92816560,BANCO REGIONAL DE DESENVOLVIMENTO DO EXTREMO SUL,4000,Por evento
34991938,"SIMPALA S.A. CRÉDITO, FINANCIAMENTO E INVESTIMENTO",3500,Por evento
8075352,COOPERATIVA DE CRÉDITO DOS EMPRESÁRIOS E EMPREGADOS DOS TRANSPORTES E CORREIOS DO SUL DO BRASIL - TRANSPOCRED,3500,Por evento
48795256,BANCO ANDBANK (BRASIL) S.A.,3000,Por evento
5040481,BANCO DE LAGE LANDEN BRASIL S.A.,3000,Por evento
2658435,BANCO CATERPILLAR S.A.,3000,Por evento
33588252,BANCO INDUSCRED DE INVESTIMENTO S.A.,3000,Por evento
15114366,BANCO BOCOM BBM S.A.,3000,Por evento
162760,MERCEDES-BENZ LEASING DO BRASIL ARRENDAMENTO MERCANTIL S.A.,2900,Por evento
33603457,BANCO RODOBENS S.A.,2900,Por evento
60814191,BANCO MERCEDES-BENZ DO BRASIL S.A.,2900,Por evento
28517628,BANCO PACCAR S.A.,2800,Por evento
517645,BANCO RIBEIRAO PRETO S.A.,2500,Por evento
5503849,"SF3 CRÉDITO, FINANCIAMENTO E INVESTIMENTO S.A.",2500,Por evento
23903068,BANCO KOMATSU DO BRASIL S.A.,2200,Por evento
11285104,"NEON FINANCEIRA - CRÉDITO, FINANCIAMENTO E INVESTIMENTO S.A.",2000,Por evento
5351887,"ZEMA CRÉDITO, FINANCIAMENTO E INVESTIMENTO S/A",2000,Por evento
11581339,BMP SOCIEDADE DE CRÉDITO AO MICROEMPREENDEDOR E A EMPRESA DE PEQUENO PORTE LTDA.,2000,Por evento
33136888,"BRB - CREDITO, FINANCIAMENTO E INVESTIMENTO S/A",2000,Por evento
2885855,BADESUL DESENVOLVIMENTO S.A - AGÊNCIA DE FOMENTO/RS,2000,Por evento
31880826,BANCO GUANABARA S.A.,2000,Por evento
55230916,INTESA SANPAOLO BRASIL S.A. - BANCO MÚLTIPLO,2000,Por evento
655522,ASSOCIACAO DE POUPANCA E EMPRESTIMO - POUPEX,2000,Por evento
62816426,SOCIÉTÉ GÉNÉRALE EQUIPMENT FINANCE S.A. - ARRENDAMENTO MERCANTIL,1970,Por evento
61533584,BANCO SOCIETE GENERALE BRASIL S.A.,1970,Por evento
60770336,BANCO ALFA DE INVESTIMENTO S.A.,1950,Por evento
3323840,BANCO ALFA S.A.,1950,Por evento
7207996,BANCO BRADESCO FINANCIAMENTOS S.A.,1750,Por evento
36658769,BANCO XCMG BRASIL S.A.,1600,Por evento
92228410,OMNI S.A. - CREDITO FINANCIAMENTO E INVESTIMENTO,1500,Por evento
36583700,"QISTA S.A. - CRÉDITO, FINANCIAMENTO E INVESTIMENTO",1500,Por evento
1852137,BANCO BRASILEIRO DE CRÉDITO SOCIEDADE ANÔNIMA,1500,Por evento
92764489,"CCB BRASIL S.A. - CRÉDITO, FINANCIAMENTOS E INVESTIMENTOS",1500,Por evento
7631026,"GOLCRED S/A - CRÉDITO, FINANCIAMENTO E INVESTIMENTO",1500,Por evento
11165756,GLOBAL FINANÇAS SOCIEDADE DE CRÉDITO AO MICROEMPREENDEDOR E À EMPRESA DE PEQUENO PORTE LTDA.,1500,Por evento
31895683,BANCO INDUSTRIAL DO BRASIL S.A.,1500,Por evento
62237425,BANCO FIDIS S/A,1500,Por evento
59285411,BANCO PAN S.A.,1500,Por evento
2992446,BANCO CNH INDUSTRIAL CAPITAL S.A.,1400,Por evento
4452473,"BMW FINANCEIRA S.A. - CREDITO, FINANCIAMENTO E INVESTIMENTO",1400,Por evento
60872983,BMW LEASING DO BRASIL S.A. - ARRENDAMENTO MERCANTIL,1400,Por evento
62307848,BANCO RCI BRASIL S.A.,1300,Por evento
59588111,BANCO VOTORANTIM S.A.,1300,Por evento
7707650,"AYMORÉ CRÉDITO, FINANCIAMENTO E INVESTIMENTO S.A.",1200,Por evento
30172491,BANCO HYUNDAI CAPITAL BRASIL S.A.,1150,Por evento
3502961,BANCO PSA FINANCE BRASIL S.A.,1099,Por evento
18846364,OMNI S.A. ARRENDAMENTO MERCANTIL,1000,Por evento
50585090,BCV - BANCO DE CRÉDITO E VAREJO S.A.,1000,Por evento
34265561,BMG LEASING S.A. ARRENDAMENTO MERCANTIL,1000,Por evento
68900810,BANCO RENDIMENTO S.A.,1000,Por evento
71027866,BANCO BS2 S.A.,1000,Por evento
17359351,STARA FINANCEIRA S.A. - CRÉDITO FINANCIAMENTO E INVESTIMENTO,1000,Por evento
11760553,"GAZINCRED S.A. SOCIEDADE DE CRÉDITO, FINANCIAMENTO E INVESTIMENTO",1000,Por evento
4379829,"NEGRESCO S.A. - CREDITO, FINANCIAMENTO E INVESTIMENTOS",1000,Por evento
558456,BANCO CETELEM S.A.,1000,Por evento
17502881,COOPERATIVA DE ECONOMIA E CRÉDITO MÚTUO DOS EMPREGADOS DA CEMIG E DAS INDÚSTRIAS METALÚRGICAS E DE MATERIAL ELÉTRICO E DOS SERVIDORES PÚBLICOS MUNICIPAIS DE JUIZ DE FORA LTDA. - SICOOB CECREMEC,1000,Por evento
9473806,"TODESCREDI S/A - CRÉDITO, FINANCIAMENTO E INVESTIMENTO",1000,Por evento
33644196,BANCO FATOR S.A.,1000,Por evento
78632767,BANCO OURINVEST S.A.,1000,Por evento
14388334,PARANÁ BANCO S.A.,1000,Por evento
10769660,AGÊNCIA DE FOMENTO DE ALAGOAS S.A.,1000,Por evento
10808037,COOPERATIVA DE CRÉDITO DOS EMPRESÁRIOS DE MANAUS - SICOOB CREDEMPRESAS-AM,1000,Por evento
28195667,BANCO ABC BRASIL S.A.,1000,Por evento
78834975,COOPERATIVA DE CRÉDITO DE LIVRE ADMISSÃO DE ASSOCIADOS DO VALE DO CANOINHAS - SICOOB CREDICANOINHAS/SC,1000,Por evento
58616418,BANCO FIBRA S.A.,1000,Por evento
61820817,BANCO PAULISTA S.A.,900,Por evento
60889128,BANCO SOFISA S.A.,900,Por evento
91669747,"DM FINANCEIRA S.A. - CRÉDITO, FINANCIAMENTO E INVESTIMENTO",900,Por evento
45437547,"SAFRA CRÉDITO, FINANCIAMENTO E INVESTIMENTO S.A.",870,Por evento
3183937,AGÊNCIA DE FOMENTO DO ESTADO DO AMAZONAS S.A. - AFEAM,800,Por evento
411939,"FINAMAX S.A. - CREDITO, FINANCIAMENTO E INVESTIMENTO",800,Por evento
10664513,BANCO AGIBANK S.A.,800,Por evento
17298092,BANCO ITAÚ BBA S.A.,756,Por evento
17192451,BANCO ITAUCARD S.A.,756,Por evento
65654303,DIBENS LEASING S.A. ARRENDAMENTO MERCANTIL,756,Por evento
38486817,BANCO DE DESENVOLVIMENTO DE MINAS GERAIS S.A.-BDMG,750,Por evento
3017677,BANCO J. SAFRA S.A.,690,Por evento
62063177,SAFRA LEASING S.A. ARRENDAMENTO MERCANTIL,690,Por evento
33040601,"CREDITAQUI FINANCEIRA S.A. - CRÉDITO, FINANCIAMENTO E INVESTIMENTO",600,Por evento
7512441,"HS FINANCEIRA S/A CREDITO, FINANCIAMENTO E INVESTIMENTOS",600,Por evento
3461243,COOPERATIVA DE CRÉDITO DO NORTE CATARINENSE - ACREDICOOP,600,Por evento
10371492,BANCO YAMAHA MOTOR DO BRASIL S.A.,600,Por evento
43818780,DAYCOVAL LEASING - BANCO MÚLTIPLO S.A.,600,Por evento
1858774,BANCO BV S.A.,600,Por evento
3215790,BANCO TOYOTA DO BRASIL S.A.,550,Por evento
62144175,BANCO PINE S.A.,500,Por evento
5841967,COOPERATIVA DE ECONOMIA E CRÉDITO MÚTUO DOS FABRICANTES DE CALÇADOS DE SAPIRANGA LTDA.,500,Por evento
2031139,SICOOB CREDIMONTES - COOPERATIVA DE CRÉDITO DE LIVRE ADMISSÃO REGIONAL DE MONTES CLAROS LTDA,500,Por evento
58497702,BANCO LETSBANK S.A.,500,Por evento
36947229,"COBUCCIO S/A - SOCIEDADE DE CRÉDITO, FINANCIAMENTO E INVESTIMENTOS",500,Por evento
9590601,COOPERATIVA DE CRÉDITO DA SERRA CATARINENSE - CREDICOMIN,500,Por evento
4833655,COOPERATIVA DE ECONOMIA E CRÉDITO MÚTUO SICOOB METALCRED,500,Por evento
3427097,COOPERATIVA DE CRÉDITO DE LIVRE ADMISSÃO DO SUL CATARINENSE - ACENTRA,500,Por evento
40768766,LIONS TRUST DISTRIBUIDORA DE TÍTULOS E VALORES MOBILIÁRIOS LTDA.,500,Por evento
11271860,"LEBES FINANCEIRA S.A. - CRÉDITO, FINANCIAMENTO E INVESTIMENTO",500,Por evento
42887133,COOPERATIVA DE CREDITO DE LIVRE ADMISSÃO DA REGIÃO SUDESTE DE MINAS GERAIS LTDA. - SICOOB CREDISUCESSO,500,Por evento
10663610,DESENVOLVE SP - AGÊNCIA DE FOMENTO DO ESTADO DE SÃO PAULO S.A.,500,Por evento
416968,BANCO INTER S.A.,500,Por evento
13728156,WESTERN UNION CORRETORA DE CÂMBIO S.A.,500,Por evento
13720915,BANCO WESTERN UNION DO BRASIL S.A.,500,Por evento
2405189,COOPERATIVA DE CRÉDITO DA GRANDE FLORIANÓPOLIS - ÚNILOS,480,Por evento
64237530,COOPERATIVA DE CRÉDITO CREDIUNA LTDA - SICOOB CREDIUNA,400,Por evento
7714057,COOPERATIVA DE ECONOMIA E CRÉDITO MÚTUO DOS PROFISSIONAIS DA ÁREA NOTARIAL E REGISTRAL - COOPNORE,400,Por evento
67030395,TRUSTEE DISTRIBUIDORA DE TÍTULOS E VALORES MOBILIÁRIOS LTDA.,400,Por evento
33923798,BANCO MASTER S/A,400,Por evento
460065,COLUNA S/A DISTRIBUIDORA DE TITULOS E VALORES MOBILIÁRIOS,400,Por evento
6040559,"KREDILIG S.A. - CRÉDITO, FINANCIAMENTO E INVESTIMENTO",400,Por evento
10218474,COOPERATIVA DE CRÉDITO DA REGIÃO DO CONTESTADO - CIVIA,380,Por evento
24537861,FFA SOCIEDADE DE CRÉDITO AO MICROEMPREENDEDOR E À EMPRESA DE PEQUENO PORTE LTDA.,350,Por evento
4814563,BANCO AFINZ S.A. - BANCO MÚLTIPLO,350,Por evento
5940203,AGENCIA DE FOMENTO DO ESTADO DO RIO DE JANEIRO S.A.,320,Por evento
37122487,"CALCRED S.A. - CRÉDITO, FINANCIAMENTO E INVESTIMENTO",300,Por evento
30723886,BANCO MODAL S.A.,300,Por evento
71590442,LASTRO RDV DISTRIBUIDORA DE TÍTULOS E VALORES MOBILIÁRIOS LTDA.,300,Por evento
61033106,BANCO CREFISA S.A.,300,Por evento
5676026,"CREDIARE S.A. - CRÉDITO, FINANCIAMENTO E INVESTIMENTO",300,Por evento
62331228,DEUTSCHE BANK S.A. - BANCO ALEMAO,300,Por evento
18287740,CONECTA CORRETORA DE CÂMBIO LTDA.,251,Por evento
11758741,BANCO FINAXIS S.A.,250,Por evento
33132044,BANCO CEDULA S.A.,250,Por evento
16779741,COOPERATIVA DE CRÉDITO DE LIVRE ADMISSÃO DO ALTO VALE DO ITAJAÍ - VIACREDI ALTO VALE,250,Por evento
9512539,COOPERATIVA DE CRÉDITO DA FOZ DO RIO ITAJAÍ AÇU - CREDIFOZ,250,Por evento
7747410,M PAGAMENTOS S.A. - CRÉDITO FINANCIAMENTO E INVESTIMENTO,200,Por evento
250699,AGK CORRETORA DE CAMBIO S.A.,200,Por evento
33042151,BANCO DE LA NACION ARGENTINA,200,Por evento
7693858,HSCM - SOCIEDADE DE CRÉDITO AO MICROEMPREENDEDOR E À EMPRESA DE PEQUENO PORTE LTDA.,200,Por evento
39669186,HEMERA DISTRIBUIDORA DE TÍTULOS E VALORES MOBILIÁRIOS LTDA.,200,Por evento
40429946,BANCO PORTO REAL DE INVESTIMENTOS S.A,200,Por evento
24795049,COOPERATIVA DE CRÉDITO DE LIVRE ADMISSÃO DO SUDOESTE GOIANO,200,Por evento
20269566,VNK SOCIEDADE DE CRÉDITO AO MICROEMPREENDEDOR E À EMPRESA DE PEQUENO PORTE LTDA.,200,Por evento
3848103,AGENCIA DE FOMENTO DO RIO GRANDE DO NORTE S.A.,200,Por evento
25536764,COOPERATIVA DE CRÉDITO CREDILUZ LTDA. - SICOOB CREDILUZ,200,Por evento
7512780,COOPERATIVA DE CRÉDITO E INVESTIMENTO COM INTERAÇÃO SOLIDÁRIA DO VALE EUROPEU - CRESOL VALE EUROPEU,200,Por evento
25387713,COOPERATIVA DE CRÉDITO DE LIVRE ADMISSÃO DA REGIÃO DE  PARÁ DE MINAS LTDA - SICOOB CREDIRURAL,200,Por evento
966246,COOPERATIVA DE CREDITO CREDICERIPA - SICOOB CREDICERIPA,200,Por evento
7237373,BANCO DO NORDESTE DO BRASIL S.A.,200,Por evento
82639451,COOPERATIVA DE CREDITO VALE DO ITAJAI - VIACREDI,190,Por evento
61024352,BANCO VOITER S.A.,180,Por evento
1152097,COOPERATIVA DE CRÉDITO CREDIMATA LTDA. - SICOOB CREDIMATA,150,Por evento
7441209,BANCO MONEO S.A.,150,Por evento
23862762,"WILL FINANCEIRA S.A. CRÉDITO, FINANCIAMENTO E INVESTIMENTO",150,Por evento
4184779,BANCO BRADESCARD S.A.,150,Por evento
17351180,BANCO TRIANGULO S.A.,150,Por evento
3058464,AGENCIA DE FOMENTO DO ESTADO DE RORAIMA S/A,150,Por evento
6284531,AGÊNCIA DE FOMENTO DO ESTADO DE MATO GROSSO S/A - DESENVOLVE MT,140,Por evento
7925729,COOPERATIVA DE CRÉDITO E INVESTIMENTO COM INTERAÇÃO SOLIDÁRIA NORTE PARANAENSE - CRESOL NORTE PARANAENSE,125,Por evento
5276770,COOPERATIVA DE CRÉDITO E INVESTIMENTO COM INTERAÇÃO SOLIDÁRIA FRONTEIRAS PR/SC/SP/ES - CRESOL FRONTEIRAS PR/SC/SP/ES,125,Por evento
4490531,COOPERATIVA DE CRÉDITO E INVESTIMENTO COM INTERAÇÃO SOLIDÁRIA DE GOIÁS - CRESOL GOIÁS,125,Por evento
8560508,COOPERATIVA DE CRÉDITO E INVESTIMENTO COM INTERAÇÃO SOLIDÁRIA TRIUNFO - CRESOL TRIUNFO,125,Por evento
6126780,COOPERATIVA DE CRÉDITO E INVESTIMENTO COM INTERAÇÃO SOLIDÁRIA GRANDES LAGOS PR/SP - CRESOL GRANDES LAGOS PR/SP,125,Por evento
2446089,COOPERATIVA DE CRÉDITO E INVESTIMENTO COM INTERAÇÃO SOLIDÁRIA UNIÃO - CRESOL UNIÃO,125,Por evento
5277312,COOPERATIVA DE CRÉDITO E INVESTIMENTO COM INTERAÇÃO SOLIDÁRIA HORIZONTE - CRESOL HORIZONTE,125,Por evento
2934201,COOPERATIVA DE CRÉDITO E INVESTIMENTO COM INTERAÇÃO SOLIDÁRIA LIDERANÇA - CRESOL LIDERANÇA,125,Por evento
971300,COOPERATIVA DE CREDITO E INVESTIMENTO COM INTERACAO SOLIDARIA PIONEIRA - CRESOL PIONEIRA,125,Por evento
6139650,COOPERATIVA DE CRÉDITO E INVESTIMENTO COM INTERAÇÃO SOLIDÁRIA DO RIO GRANDE DO SUL - CRESOL RIO GRANDE DO SUL,125,Por evento
10520232,COOPERATIVA DE CRÉDITO E INVESTIMENTO COM INTERAÇÃO SOLIDÁRIA DA AMAZÔNIA - CRESOL AMAZÔNIA,125,Por evento
4663561,COOPERATIVA DE CRÉDITO E INVESTIMENTO COM INTERAÇÃO SOLIDÁRIA VALE DAS ÁGUAS - CRESOL VALE DAS ÁGUAS,125,Por evento
5231945,COOPERATIVA DE CRÉDITO E INVESTIMENTO COM INTERAÇÃO SOLIDÁRIA UNIÃO DOS VALES - CRESOL UNIÃO DOS VALES,125,Por evento
8624548,COOPERATIVA DE CRÉDITO E INVESTIMENTO COM INTERAÇÃO SOLIDÁRIA DE MINAS GERAIS - CRESOL MINAS GERAIS,125,Por evento
7268499,COOPERATIVA DE CRÉDITO E INVESTIMENTO COM INTERAÇÃO SOLIDÁRIA INTEGRAÇÃO - CRESOL INTEGRAÇÃO,125,Por evento
3965737,COOPERATIVA DE CRÉDITO E INVESTIMENTO COM INTERAÇÃO SOLIDÁRIA VANGUARDA - CRESOL VANGUARDA,125,Por evento
4350225,COOPERATIVA DE CRÉDITO E INVESTIMENTO COM INTERAÇÃO SOLIDÁRIA TRADIÇÃO - CRESOL TRADIÇÃO,125,Por evento
2448310,COOPERATIVA DE CRÉDITO E INVESTIMENTO COM INTERAÇÃO SOLIDÁRIA PROGRESSO - CRESOL PROGRESSO,125,Por evento
11969853,COOPERATIVA DE CRÉDITO E INVESTIMENTO COM INTERAÇÃO SOLIDÁRIA CONEXÃO - CRESOL CONEXÃO,125,Por evento
15173776,SOCIAL BANK BANCO MÚLTIPLO S/A,120,Por evento
4866275,BANCO INBURSA S.A.,120,Por evento
89280960,COOPERATIVA DE ECONOMIA E CREDITO MUTUO DOS EMPREGADOS DAS EMPRESAS RANDON,110,Por evento
81016131,COOPERATIVA DE CRÉDITO DE LIVRE ADMISSÃO DE ASSOCIADOS DO VALE DO VINHO - SICOOB VALE DO VINHO,110,Por evento
63229629,COOPERATIVA DE CREDITO RURAL ASCOOB SISAL,"108,24",Por evento
7564184,COOPERATIVA DE CRÉDITO RURAL ASCOOB SERTÕES - ASCOOB SERTÕES,"108,24",Por evento
2025743,COOPERATIVA DE CRÉDITO E INVESTIMENTO COM INTERAÇÃO SOLIDÁRIA VALE DO OURO - CRESOL VALE DO OURO,"108,24",Por evento
71479653,COOPERATIVA DE ECONOMIA E CRÉDITO MÚTUO DOS MÉDICOS E DEMAIS PROFISSIONAIS DA ÁREA DE SAÚDE DE NÍVEL SUPERIOR DE JUIZ DE FORA LTDA. - UNICRED CAMINHO NOVO,100,Por evento
26178111,COOPERATIVA DE CRÉDITO UNIÃO CENTRO OESTE LTDA. - SICOOB UNIÃO CENTRO OESTE,100,Por evento
26359745,COOPERATIVA DE CRÉDITO SICOOBMAIS  LTDA. - SICOOBMAIS,100,Por evento
4120633,COOPERATIVA DE CREDITO CLASSICA DO ESTADO DO RIO DE JANEIRO - SICOOB EMPRESAS RJ,100,Por evento
81367880,COOPERATIVA DE CRÉDITO DE LIVRE ADMISSÃO DE ASSOCIADOS SUL CATARINENSE - SICOOB CREDISULCA SC,100,Por evento
27348513,FINANCRED - SOCIEDADE DE CRÉDITO AO MICROEMPREENDEDOR E A EMPRESA DE PEQUENO PORTE LTDA.,100,Por evento
42934794,COOPERATIVA DE CRÉDITO CREDIPIMENTA LTDA. - SICOOB CREDIPIMENTA,100,Por evento
52937216,BEXS CORRETORA DE CÂMBIO S/A,100,Por evento
78626983,BANCO VR S.A.,100,Por evento
73622748,B&T CORRETORA DE CAMBIO LTDA.,100,Por evento
10143743,COOPERATIVA DE CRÉDITO DE LIVRE ADMISSÃO DE ASSOCIADOS DO SUL DO BRASIL - CREVISC,100,Por evento
1522368,BANCO BNP PARIBAS BRASIL S.A.,100,Por evento
4079285,COOPERATIVA DE CRÉDITO DE LIVRE ADMISSÃO DE ITAJUBÁ LTDA - SICOOB SUDESTE MAIS,100,Por evento
3443143,AVIPAM CORRETORA DE CAMBIO LTDA,100,Por evento
25395435,COOPERATIVA DE CRÉDITO CREDICAF LTDA - SICOOB CREDICAF,100,Por evento
8647473,COOPERATIVA DE CRÉDITO E ECONOMIA COM INTERAÇÃO SOLIDÁRIA DE CORONEL FREITAS - CRESOL CORONEL FREITAS,100,Por evento
19869338,COOPERATIVA DE CREDITO DE LIVRE ADMISSAO DO VALE DO AÇO LTDA - SICOOB VALE DO AÇO,100,Por evento
5097757,COOPERATIVA DE CRÉDITO E SERVIÇOS FINANCEIROS DE CURITIBA E REGIÃO METROPOLITANA,100,Por evento
28145829,BANCO DE DESENVOLVIMENTO DO ESPIRITO SANTO S.A.,100,Por evento
2641969,COOPERATIVA DE CRÉDITO DE LIVRE ADMISSÃO DE ASSOCIADOS NOVA TRENTO   SICOOB TRENTOCREDI SC,100,Por evento
25606237,COOPERATIVA DE POUPANÇA E CRÉDITO DO VALE DO RIO DOCE LTDA - SICOOB CREDIRIODOCE,80,Por evento
26178533,COOPERATIVA DE CRÉDITO DE LIVRE ADMISSÃO DO PONTAL DO TRIANGULO LTDA - SICOOB CREDIPONTAL,80,Por evento
869687,COOPERATIVA DE CRÉDITO DE LIVRE ADMISSÃO DE BOA ESPERANÇA LTDA. - SICOOB BELCREDI,80,Por evento
4902979,BANCO DA AMAZONIA S.A.,80,Por evento
8795285,COOPERATIVA DE CRÉDITO DE LIVRE ADMISSÃO SICOOB CREDIACIL,"78,6",Por evento
1009908,COOPERATIVA DE CREDITO DE LIVRE ADMISSAO DE PARA DE MINAS LTDA - SICOOB ASCICRED,75,Por evento
1559914,SICOOB AC CREDI - COOPERATIVA DE CRÉDITO DE LIVRE ADMISSÃO DO LESTE E NORDESTE MINEIRO LTDA.,75,Por evento
9004796,COOPERATIVA DE ECONOMIA E CRÉDITO MÚTUO SICOOB CRED-ACILPA,70,Por evento
3732359,COOPERATIVA DE CRÉDITO DE LIVRE ADMISSÃO DE PERNAMBUCO - SICOOB PERNAMBUCO,70,Por evento
41669227,COOPERATIVA DE CRÉDITO DE PRODUTORES RURAIS E DE LIVRE ADMISSÃO DO TRIÂNGULO LTDA    SICOOB CREDITRIL,70,Por evento
41931445,COOPERATIVA DE CRÉDITO CREDIFOR LTDA - SICOOB CREDIFOR,70,Por evento
25404542,COOPERATIVA DE CREDITO DE LIVRE ADMISSÃO DO VALE DO GORUTUBA LTDA - SICOOB CREDIVAG,70,Por evento
4355489,COOPERATIVA DE CRÉDITO UNICRED COOMARCA LTDA. - COOMARCA,"68,66",Por evento
75847,COOPERATIVA DE CRÉDITO UNICRED CENTRO-SUL LTDA - UNICRED CENTRO-SUL,"68,66",Por evento
73443863,COOPERATIVA DE CRÉDITO UNICRED VALE LTDA - UNICRED VALE,"68,66",Por evento
74114042,COOPERATIVA DE CRÉDITO UNICRED UNIÃO LTDA - UNICRED UNIÃO,"68,66",Por evento
74064502,COOPERATIVA DE CRÉDITO UNICRED VALOR CAPITAL LTDA - UNICRED VALOR CAPITAL,"68,66",Por evento
1039011,COOPERATIVA DE CRÉDITO UNICRED DESBRAVADORA LTDA - UNICRED DESBRAVADORA,"68,66",Por evento
4913711,BANCO DO ESTADO DO PARÁ S.A.,65,Por evento
7669921,COOPERATIVA DE CRÉDITO MÚTUO - SICOOB CREDIACISC,65,Por evento
1699652,COOPERATIVA DE CRÉDITO DE LIVRE ADMISSÃO DA REGIÃO DE GUAXUPÉ LTDA. - SICOOB ACICREDI,65,Por evento
1060307,COOPERATIVA DE CRÉDITO DE LIVRE ADMISSÃO DA UNIÃO DOS VALES DO PIRANGA E MATIPÓ LTDA. - SICOOB UNIÃO DOS VALES,63,Por evento
24431221,COOPERATIVA DE CRÉDITO E INVESTIMENTO COM INTERAÇÃO SOLIDÁRIA TRANSAMAZÔNICA - CRESOL TRANSAMAZÔNICA,"62,69",Por evento
2335109,COOPERATIVA DE CRÉDITO DE LIVRE ADMISSÃO DA ZONA DA MATA LTDA   SICOOB COOPEMATA,62,Por evento
81607046,COOPERATIVA DE CRÉDITO DE LIVRE ADMISSÃO DE ASSOCIADOS SÃO MIGUEL DO OESTE - SICOOB SÃO MIGUEL SC/PR/RS,61,Por evento
66259110,COOPERATIVA DE CRÉDITO CREDIBAM LTDA. - SICOOB CREDIBAM,60,Por evento
4306351,INDEPENDÊNCIA COOPERATIVA DE CRÉDITO E INVESTIMENTO - INDEPENDÊNCIA COOPERATIVA DE CRÉDITO,60,Por evento
33370115,COOPERATIVA DE ECONOMIA E CRÉDITO MÚTUO DOS EMPREGADOS DE FURNAS E DAS DEMAIS EMPRESAS DO SISTEMA ELETROBRÁS LTDA. - SICOOB CECREMEF,60,Por evento
71243034,COOPERATIVA DE CRÉDITO CREDIJEQUITINHONHA LTDA. - SICOOB CREDIJEQUITINHONHA,60,Por evento
82133182,COOPERATIVA DE CRÉDITO DO VALE EUROPEU - SICOOB EURO VALE,60,Por evento
3941182,COOPERATIVA DE CRÉDITO DE LIVRE ADMISSÃO DO CIRCUITO DAS ÁGUAS - SICOOB CIRCUITO DAS ÁGUAS,60,Por evento
5856736,COOPERATIVA DE ECONOMIA E CRÉDITO DE LIVRE ADMISSÃO LTDA. - SICOOB EMPRESARIAL,60,Por evento
6324872,COOPERATIVA DE CRÉDITO CREDINOSSO LTDA - SICOOB CREDINOSSO,60,Por evento
3635061,CREDBRASIL - SOCIEDADE DE CRÉDITO AO MICROEMPREENDEDOR LTDA,60,Por evento
17184037,BANCO MERCANTIL DO BRASIL S.A.,60,Por evento
30306294,BANCO BTG PACTUAL S.A.,60,Por evento
9579249,"COOPERATIVA DE ECONOMIA E CRÉDITO MÚTUO DOS EMPRESÁRIOS DE AMERICANA, LIMEIRA E REGIÃO - SICOOB ACICRED",60,Por evento
33579731,COOPERATIVA DE CRÉDITO DE LIVRE ADMISSÃO DO CENTRO-SUL GOIANO LTDA,60,Por evento
2924977,"COOPERATIVA DE CRÉDITO, POUPANÇA E INVESTIMENTO DOS PROFISSIONAIS MÉDICOS E DA SAÚDE DE CURITIBA E REGIÃO METROPOLITANA - SICREDI MEDICRED PR",60,Por evento
10262276,COOPERATIVA DE CRÉDITO DE LIVRE ADMISSÃO DO ESTADO DE SÃO PAULO - SICOOB PAULISTA,60,Por evento
86389236,COOPERATIVA DE CRÉDITO SICOOB UNI SUDESTE,60,Por evento
2232383,COOPERATIVA DE CRÉDITO DE LIVRE ADMISSÃO DA REGIÃO DO CIRCUITO CAMPOS DAS VERTENTES LTDA - SICOOB COPERMEC,60,Por evento
58160789,BANCO SAFRA S.A.,60,Por evento
88894548,"COOPERATIVA DE CRÉDITO, POUPANÇA E INVESTIMENTO UNIÃO - SICREDI UNIAO RS/ES",60,Por evento
87780284,"COOPERATIVA DE CRÉDITO, POUPANÇA E INVESTIMENTO VALE DO JAGUARI E ZONA DA MATA - SICREDI VALE DO JAGUARI E ZONA DA MATA RS/MG",60,Por evento
86585049,COOPERATIVA DE CRÉDITO DA REGIÃO DO VALE DO RIO GRANDE LTDA. - SICOOB CREDILEITE,60,Por evento
66398496,COOPERATIVA DE CRÉDITO CREDIARA LTDA - SICOOB CREDIARA,55,Por evento
60783503,SAFRA CORRETORA DE VALORES E CÂMBIO LTDA.,55,Por evento
7853842,UNIPRIME OURO - COOPERATIVA DE CRÉDITO DE OURO,55,Por evento
1073966,COOPERATIVA DE CRÉDITO RURAL DE ABELARDO LUZ - SULCREDI/CREDILUZ,55,Por evento
803287,COOPERATIVA DE CRÉDITO CREDIVAZ LTDA. - SICOOB CREDIVAZ,55,Por evento
68512748,COOPERATIVA DE CRÉDITO CREDIESMERALDAS LTDA. - SICOOB CREDIESMERALDAS,55,Por evento
62073200,BANK OF AMERICA MERRILL LYNCH BANCO MÚLTIPLO S.A.,51,Por evento
10690848,BANCO DA CHINA BRASIL S.A.,50,Por evento
71154256,COOPERATIVA DE CRÉDITO SACRAMENTO LTDA - SICOOB SACRAMENTO,50,Por evento
4261151,COOPERATIVA DE CRÉDITO E INVESTIMENTO COM INTERAÇÃO SOLIDÁRIA TRANSFORMAÇÃO - CRESOL TRANSFORMAÇÃO,50,Por evento
8240446,COOPERATIVA DE CREDITO RURAL DE IBIAM - SULCREDI/IBIAM,50,Por evento
5241619,COOPERATIVA DE CRÉDITO DE LIVRE ADMISSÃO DO MÉDIO LESTE DE MATO GROSSO - SICOOB PRIMAVERA MT,50,Por evento
5983995,COOPERATIVA DE CRÉDITO E INVESTIMENTO COM INTERAÇÃO SOLIDÁRIA COOPERAR - CRESOL COOPERAR,50,Por evento
33172537,BANCO J.P. MORGAN S.A.,50,Por evento
10453077,COOPERATIVA DE CRÉDITO RURAL COM INTERAÇÃO SOLIDÁRIA REALIZA - CRESOL REALIZA,50,Por evento
1090027,COOPERATIVA DE ECONOMIA E CREDITO MUTUO DOS MEDICOS E CATEGORIAS AFINS-UNICRED NITEROI LTDA,50,Por evento
10319386,COOPERATIVA DE CRÉDITO DE LIVRE ADMISSÃO DO CENTRO SUL DE MATO GROSSO DO SUL - SICOOB CENTRO SUL MS,50,Por evento
71154876,COOPERATIVA DE CRÉDITO DE LIVRE ADMISSÃO DO NOROESTE DE MINAS GERAIS LTDA.   SICOOB CREDIPINHO,50,Por evento
7412987,COOPERATIVA DE CRÉDITO E ECONOMIA COM INTERAÇÃO SOLIDÁRIA - CRESOL ALIANÇA,50,Por evento
71230338,COOPERATIVA DE CRÉDITO DE LIVRE ADMISSÃO DE ARCOS LTDA. - SICOOB ARCOMCREDI,50,Por evento
71237184,COOPERATIVA DE CRÉDITO CREDIBELO LTDA. - SICOOB CREDIBELO,50,Por evento
3326437,COOPERATIVA DE CRÉDITO DE LIVRE ADMISSÃO DO CENTRO NORTE DOS ESTADOS DE MATO GROSSO E MATO GROSSO DO SUL - SICOOB UNIÃO MT/MS,50,Por evento
2766672,COOPERATIVA DE CRÉDITO RURAL COM INTERAÇÃO SOLIDÁRIA PLANALTO SERRANO - CRESOL PLANALTO SERRANO,50,Por evento
18966739,COOPERATIVA DE CRÉDITO COPERSUL LTDA - SICOOB COPERSUL,50,Por evento
25683475,COOPERATIVA DE CRÉDITO DE LIVRE ADMISSÃO DO VALE DO RIO GRANDE LTDA. - SICOOB UBERABA,50,Por evento
1155801,COOPERATIVA DE CRÉDITO RURAL COM INTERAÇÃO SOLIDÁRIA CENTRO SERRA - CRESOL CENTRO SERRA,50,Por evento
78840071,COOPERATIVA DE CRÉDITO DE LIVRE ADMISSÃO DE ASSOCIADOS DO ALTO URUGUAI CATARINENSE - SICOOB CREDIAUC,50,Por evento
78858107,COOPERATIVA DE CRÉDITO DE LIVRE ADMISSÃO DE ASSOCIADOS AURIVERDE -  SICOOB - CREDIAL SC/RS,50,Por evento
78825270,COOPERATIVA DE CRÉDITO MAXI ALFA DE LIVRE ADMISSÃO DE ASSOCIADOS - SICOOB MAXICRÉDITO,50,Por evento
1667352,COOPERATIVA DE CRÉDITO DE LIVRE ADMISSÃO DO SERTÃO DE MINAS GERAIS LTDA. - SICOOB SERTÃO MINAS,50,Por evento
78825023,COOPERATIVA DE CRÉDITO DE LIVRE ADMISSÃO DE ASSOCIADOS OESTE CATARINENSE,50,Por evento
4622657,COOPERATIVA DE CRÉDITO RURAL COM INTERAÇÃO SOLIDÁRIA GERAÇÕES - CRESOL GERAÇÕES,50,Por evento
22656789,COOPERATIVA DE CREDITO CREDISUDESTE LTDA. - SICOOB CREDISUDESTE,50,Por evento
1657678,COOPERATIVA DE CRÉDITO DE LIVRE ADMISSÃO DA REGIÃO DE SÃO SEBASTIÃO DO PARAÍSO LTDA. - SICOOB PARAÍSOCRED,50,Por evento
38588174,COOPERATIVA DE CRÉDITO CREDICOPE LTDA. - SICOOB CREDICOPE,50,Por evento
7465539,COOPERATIVA DE CRÉDITO RURAL COM INTERAÇÃO SOLIDÁRIA ALTO VALE - CRESOL ALTO VALE,50,Por evento
24799033,COOPERATIVA DE CRÉDITO DE LIVRE ADMISSÃO DO VALE DO PARANAÍBA LTDA.,50,Por evento
8742188,COOPERATIVA DE CRÉDITO DE LIVRE ADMISSÃO UNIÃO E NEGÓCIOS - SICOOB INTEGRAÇÃO,50,Por evento
9433005,COOPERATIVA DE CRÉDITO RURAL COM INTERAÇÃO SOLIDÁRIA VALE DO CONTESTADO - CRESOL VALE DO CONTESTADO,50,Por evento
86829827,COOPERATIVA DE CRÉDITO DE LIVRE ADMISSÃO DO VALE - SICOOB CREDIVALE/SC,50,Por evento
3612764,COOPERATIVA DE CRÉDITO  DE FRONTEIRAS  LTDA. - SICOOB FRONTEIRAS,50,Por evento
5247312,COOPERATIVA DE CRÉDITO DE LIVRE ADMISSÃO BURITIS - SICOOB BURITIS,50,Por evento
17453575,ICBC DO BRASIL BANCO MÚLTIPLO S.A.,50,Por evento
53935029,COOPERATIVA DE CRÉDITO COOCRELIVRE,50,Por evento
8071414,COOPERATIVA DE ECONOMIA E CRÉDITO MÚTUO - SICOOB COOPERAC,50,Por evento
2090126,COOPERATIVA DE CRÉDITO DE LIVRE ADMISSÃO DE ASSOCIADOS VALE DO CHAPECOZINHO - SICOOB VALCREDI SUL,50,Por evento
73254757,COOPERATIVA DE CREDITO E ECONOMIA COM INTERAÇÃO SOLIDARIA DE QUILOMBO - CRESOL QUILOMBO,50,Por evento
