Cnpj,RazaoSocial,ValorMaximo,Periodicidade
7320890,COOPERATIVA DE CRÉDITO E ECONOMIA COM INTERAÇÃO SOLIDÁRIA CRESOL VALE,0,-
7070495,"COOPERATIVA DE CRÉDITO, POUPANÇA E INVESTIMENTO EMPREENDEDORES - SICREDI EMPREENDEDORES PR",0,-
24361690,LIMINE TRUST DISTRIBUIDORA DE TÍTULOS E VALORES MOBILIÁRIOS LTDA.,0,-
28811341,STONEX BANCO DE CÂMBIO S.A.,0,-
2083914,COOPERATIVA DE CRÉDITO MÚTUO DOS POLICIAIS FEDERAIS E SERVIDORES DA UNIÃO NO ESPÍRITO SANTO - CREDFEDERAL,0,-
6132348,LABOR SOCIEDADE CORRETORA DE CÂMBIO LTDA.,0,-
5491616,"COOPERATIVA DE CRÉDITO, POUPANÇA E SERVIÇOS FINANCEIROS DO CENTRO OESTE - CREDITAG",0,-
93026847,BANRISUL S/A - CORRETORA DE VALORES MOBILIARIOS E CAMBIO,0,-
26408187,COOPERATIVA DE CRÉDITO POUPANÇA E INVESTIMENTO PANTANAL DO MATO GROSSO DO SUL - SICREDI PANTANAL MS,0,-
35479592,"DUFRIO FINANCEIRA, CRÉDITO, FINANCIAMENTO E INVESTIMENTOS S.A.",0,-
26529420,"COOPERATIVA DE CRÉDITO, POUPANÇA E INVESTIMENTO OURO VERDE DO MATO GROSSO - SICREDI OURO VERDE MT",0,-
12392983,"MIRAE ASSET WEALTH MANAGEMENT (BRAZIL) CORRETORA DE CÂMBIO, TÍTULOS E VALORES MOBILIÁRIOS LTDA.",0,-
2104058,COOPERATIVA DE CRÉDITO MÚTUO DOS EMPREGADOS DA PILKINGTON BRASIL,0,-
26555235,"COOPERATIVA DE CRÉDITO, POUPANÇA E INVESTIMENTO SORRISO - SICREDI CELEIRO MT/RR",0,-
3358914,COOPERATIVA DE CREDITO CREDIROCHAS - SICOOB CREDIROCHAS,0,-
89126130,"COOPERATIVA DE CRÉDITO, POUPANÇA E INVESTIMENTO DA REGIÃO DOS VALES - SICREDI REGIÃO DOS VALES RS",0,-
4751713,COOPERATIVA DE CRÉDITO E INVESTIMENTOS DE RONDÔNIA - SICOOB CREDJURD,0,-
7945233,PÓLOCRED   SOCIEDADE DE CRÉDITO AO MICROEMPREENDEDOR E À EMPRESA DE PEQUENO PORTE LTDA.,0,-
11406965,HAITONG DO BRASIL DISTRIBUIDORA DE TÍTULOS E VALORES MOBILIÁRIOS S.A.,0,-
73302408,EXIM CORRETORA DE CAMBIO LTDA,0,-
12063256,MONETAR DISTRIBUIDORA DE TÍTULOS E VALORES MOBILIÁRIOS LTDA.,0,-
4772908,ATLANTA SOCIEDADE DE CRÉDITO AO MICROEMPREENDEDOR LTDA,0,-
3165497,COOPERATIVA DE ECONOMIA E CREDITO MUTUO DOS FUNCIONARIOS DA SANEPAR - CREDISANEPAR,0,-
20177390,COOPERATIVA DE ECONOMIA E CREDITO MUTUO DOS TRABALHADORES DO GRUPO EMPRESARIAL ITATIAIA LTDA. - COOPERITA,0,-
11545653,DOURADA - SOCIEDADE DE CRÉDITO AO MICROEMPREENDEDOR E À EMPRESA DE PEQUENO PORTE LTDA,0,-
20833976,COOPERATIVA DE CRÉDITO DOS SERVIDORES PÚBLICOS MUNICIPAIS DE TIMÓTEO LTDA. - COOPERTIM,0,-
4565791,COOPERATIVA DE CRÉDITO E ECONOMIA COM INTERAÇÃO SOLIDÁRIA DE ARATIBA - CRESOL ARATIBA,0,-
1848322,"UNIPRIME DO IGUAÇU - COOPERATIVA DE CRÉDITO, POUPANÇA E INVESTIMENTO",0,-
9463721,COOPERATIVA DE CREDITO E ECONOMIA COM INTERAÇÃO SOLIDÁRIA - CRESOL JACINTO MACHADO,0,-
71146450,COOPERATIVA DE CRÉDITO DE LIVRE ADMISSÃO DE CAMPOS GERAIS E CAMPO DO MEIO LTDA - SICOOB CREDCAM,0,-
8430732,SCB CRÉDITO SOCIEDADE DE CRÉDITO AO MICROEMPREENDEDOR E À EMPRESA DE PEQUENO PORTE LTDA.,0,-
71336432,SICOOB CREDIMED - COOPERATIVA DE CRÉDITO DE LIVRE ADMISSÃO DA CIDADE DE UBERABA LTDA.,0,-
10143499,COOPERATIVA DE CRÉDITO DE LIVRE ADMISSÃO DE JATAÍ E REGIÃO LTDA.,0,-
3320525,COOPERATIVA DE CRÉDITO ARACOOP LTDA. - SICOOB ARACOOP,0,-
1864151,COOPERATIVA  ECONOMIA CRÉDITO MÚTUO  SERVS E EMPREGADOS PÚBLICOS MUNIC DE BELO HORIZONTE BETIM BRUMADINHO CONTAGEM IBIRITÉ NOVA LIMA RIBEIRÃO DAS NEVES SABARÁ SANTA LUZIA E VESPASIANO SICOOB CREDISERV,0,-
3317692,FINAXIS CORRETORA DE TÍTULOS E VALORES MOBILIÁRIOS S.A.,0,-
76621457,4UM DISTRIBUIDORA DE TÍTULOS E VALORES MOBILIÁRIOS S.A.,0,-
71207740,COOPERATIVA DE CRÉDITO RURAL DE IRAÍ DE MINAS LTDA -SICOOB CREDIMIL,0,-
7333726,ONNIX CORRETORA DE CÂMBIO LTDA.,0,-
82065285,"COOPERATIVA DE CREDITO, POUPANÇA E INVESTIMENTO PARQUE DAS ARAUCARIAS - SICREDI PARQUE DAS ARAUCARIAS PR/SC/SP",0,-
40434681,AZUMI DISTRIBUIDORA DE TÍTULOS E VALORES MOBILIÁRIOS LTDA.,0,-
76641497,DOURADA CORRETORA DE CÂMBIO LTDA.,0,-
9488496,COOPERATIVA DE CREDITO E ECONOMIA COM INTERAÇÃO SOLIDARIA - CRESOL SÃO JOÃO DO SUL,0,-
71418784,"COOPERATIVA DE CRÉDITO DOS MÉDICOS, TÉCNICOS E DEMAIS PROFISSIONAIS DA SAÚDE DO SUL DE MINAS LTDA., UNICRED SUL DE MINAS",0,-
50579044,LEVYCAM - CORRETORA DE CAMBIO E VALORES LTDA.,0,-
2282709,COOPERATIVA DE CRÉDITO DE LIVRE ADMISSÃO DO CENTRO NORTE BRASILEIRO,0,-
71441406,COOPERATIVA DE CRÉDITO DE LIVRE ADMISSÃO DE PEDRO LEOPOLDO LTDA - SICOOB CREDIPEL,0,-
20158571,HR SOCIEDADE DE CRÉDITO AO MICROEMPREENDEDOR E À EMPRESA DE PEQUENO PORTE LTDA.,0,-
67915868,COOPERATIVA DE ECONOMIA E CRÉDITO MÚTUO DOS TRABALHADORES DA CIA. DE PROCESSAMENTO DE DADOS DO ESTADO DE SÃO PAULO - CREDIPRODESP,0,-
5979692,COOPERATIVA DE CRÉDITO DOS PROFISSIONAIS DOS CREAS E DEMAIS ÁREAS TECNOLÓGICAS - CREDCREA,0,-
9128022,COOPERATIVA DE ECONOMIA E CRÉDITO MÚTUO DOS FUNCIONÁRIOS DA NAKATA,0,-
25674235,MUNDINVEST S.A.-CORRETORA DE CAMBIO E VALORES MOBILIARIOS,0,-
4886317,"COOPERATIVA DE CRÉDITO, POUPANÇA E INVESTIMENTO DOS INTEGRANTES DA MAGISTRATURA E DO MINISTÉRIO PÚBLICO NO ESTADO DO PARANÁ - SICREDI CREDJURIS",0,-
8044854,COOPERATIVA DE CREDITO DO CENTRO DO ESTADO DE RONDONIA - SICOOB CENTRO,0,-
59281253,BTG PACTUAL SERVIÇOS FINANCEIROS S.A. DISTRIBUIDORA DE TÍTULOS E VALORES MOBILIÁRIOS,0,-
991739,COOPERATIVA DE ECONOMIA E CRÉDITO MÚTUO DOS SERVIDORES PÚBLICOS DA REGIÃO METROPOLITANA DE BELÉM - CREDISIS CREDBEM METROPOLITANA,0,-
34111187,HAITONG BANCO DE INVESTIMENTO DO BRASIL S.A.,0,-
34265629,INTERCAM CORRETORA DE CÂMBIO LTDA.,0,-
32983165,"COOPERATIVA DE CRÉDITO, POUPANÇA E INVESTIMENTO VALE DO CERRADO - SICREDI VALE DO CERRADO",0,-
32995755,"COOPERATIVA DE CRÉDITO, POUPANÇA E INVESTIMENTO DO SUDOESTE MT/PA - SICREDI SUDOESTE MT/PA",0,-
62605290,COOPERATIVA DE CRÉDITO DOS EMPREGADOS DAS EMPRESAS DO GRUPO INDORAMA NO BRASIL,0,-
1582158,OPPORTUNITY DISTRIBUIDORA DE TÍTULOS E VALORES MOBILIÁRIOS LTDA,0,-
2057584,COOPERATIVA DE CRÉDITO SICOOB SERTÃO LTDA,0,-
32648370,FAIR CORRETORA DE CAMBIO S.A.,0,-
34169557,BANCO MERCANTIL DE INVESTIMENTOS S/A,0,-
2475222,COOPERATIVA DE ECONOMIA E CREDITO MUTUO DOS SERVIDORES ESTATUTARIOS DA ADMINISTRACAO DIRETA DO ESTADO DO ESPIRITO SANTO - COOPFISCO,0,-
33022690,"COOPERATIVA DE CRÉDITO, POUPANÇA E INVESTIMENTO DO NOROESTE DE MATO GROSSO, ACRE E AMAZONAS - SICREDI BIOMAS",0,-
2935307,COOPERATIVA DE CRÉDITO SICOOB CREDSEGURO LTDA.,0,-
62673470,COOPERATIVA DE CRÉDITO SICOOB COOPMIL,0,-
2493000,"COOPERATIVA DE ECONOMIA E CRÉDITO MÚTUO NOS ESTADOS DE ALAGOAS, SERGIPE E BAHIA - SICOOB LESTE",0,-
43815158,BTG PACTUAL CORRETORA DE TÍTULOS E VALORES MOBILIÁRIOS S.A.,0,-
26014175,COOPERATIVA DE CRÉDITO GUARANICREDI LTDA. - SICOOB GUARANICREDI,0,-
92675578,COOPERATIVA DE ECONOMIA E CRÉDITO MÚTUO DOS EMPREGADOS DO SISTEMA FIERGS - CRESUL,0,-
33021064,"COOPERATIVA DE CRÉDITO, POUPANÇA E INVESTIMENTO DO ARAGUAIA E XINGU - SICREDI ARAXINGU",0,-
70431630,"COOPERATIVA DE CRÉDITO, POUPANÇA E INVESTIMENTO UNIVALES - SICREDI UNIVALES MT/RO",0,-
63062749,FXC CORRETORA DE VALORES S.A.,0,-
70038237,COOPERATIVA DE CRÉDITO - SICREDI RIO GRANDE DO NORTE,0,-
6373777,BOA VIAGEM SOCIEDADE CORRETORA DE CÂMBIO LTDA.,0,-
97489280,"COOPERATIVA DE CRÉDITO, POUPANÇA E INVESTIMENTO SICREDI INTEGRAÇÃO BAHIA - SICREDI INTEGRAÇÃO BAHIA",0,-
11417016,SCANIA BANCO S.A.,0,-
97406706,HP FINANCIAL SERVICES ARRENDAMENTO MERCANTIL S.A.,0,-
13059145,BEXS BANCO DE CÂMBIO S/A,0,-
33894445,HAITONG SECURITIES DO BRASIL CORRETORA DE CÂMBIO E VALORES MOBILIÁRIOS S.A.,0,-
26191078,COOPERATIVA DE CRÉDITO DE LIVRE ADMISSÃO DA REGIÃO SUL DO MARANHÃO - SICREDI SUL DO MARANHÃO,0,-
16854999,SINGRATUR CORRETORA DE CÂMBIO LTDA,0,-
49654502,COOPERATIVA DE CRÉDITO RURAL DOS FORNECEDORES DE CANA DA REGIÃO DE CATANDUVA-COFOCRED,0,-
25528753,COOPERATIVA DE CRÉDITO DE LIVRE ADMISSÃO DA REGIÃO DE DIVINÓPOLIS LTDA - SICOOB CREDIVERDE,0,-
59274605,BANCO GM S.A.,0,-
43060029,NOVINVEST CORRETORA DE VALORES MOBILIARIOS LTDA.,0,-
4546162,COOPERATIVA DE CRÉDITO MÚTUO DE SERVIDORES PÚBLICOS DO ESTADO DE SÃO PAULO - CREDIFISCO,0,-
3519240,COOPERATIVA DE CRÉDITO DOS INTEGRANTES DO PODER JUDICIÁRIO E DO MINISTÉRIO PÚBLICO DO ESTADO DE MINAS GERAIS LTDA. - SICOOB JUS-MP,0,-
21110927,COOPERATIVA DE CRÉDITO CLÁSSICA DOS FUNCIONÁRIOS E PRESTADORES DE SERVIÇOS DAS EMPRESAS LIGADAS AO GRUPO EUCATUR LTDA. - SICOOB EUCRED,0,-
5389174,MODAL DISTRIBUIDORA DE TITULOS E VALORES MOBILIARIOS LTDA,0,-
83325811,CREDISIS COOPERUFPA - COOPERATIVA DE ECONOMIA E CRÉDITO MÚTUO DOS SERVIDORES PÚBLICOS FEDERAIS E ESTADUAIS E DAS ENTIDADES DE ENSINO COM SEUS RESPECTIVOS FUNCIONÁRIOS NO ESTADO DO PARÁ,0,-
87795639,COOPERATIVA DE CRÉDITO ALIANÇA RS/SC/ES - SICREDI ALIANÇA RS/SC/ES,0,-
6332931,"COOPERATIVA DE CRÉDITO, POUPANÇA E INVESTIMENTO DO CERRADO DE GOIÁS - SICREDI CERRADO GO",0,-
35551187,"PLANTAE S.A. - CRÉDITO, FINANCIAMENTO E INVESTIMENTO",0,-
67031757,COOPERATIVA DE ECONOMIA E CRÉDITO MÚTUO DOS EMPREGADOS DA PRODAM/SP - CREDIPRODAM,0,-
5292849,COOPERATIVA DE CRÉDITO MÚTUO DOS EMPREGADOS EM EMPRESAS ADMINISTRADORAS DE AEROPORTOS - AEROCRED,0,-
106180,"CENTRAL DAS COOPERATIVAS DE CRÉDITO DOS ESTADOS DE MATO GROSSO, MATO GROSSO DO SUL E DO MUNICÍPIO DE CACOAL/RO - SICOOB CENTRAL RONDON",0,-
8143326,COOPERATIVA DE CRÉDITO DOS MÉDICOS E PROFISSIONAIS DE SAÚDE DE SÃO LUÍS - SICREDI SÃO LUÍS,0,-
57839805,BANCO TRICURY S.A.,0,-
2602922,"COOPERATIVA DE CRÉDITO DOS MÉDICOS, SERVIDORES PÚBLICOS E EMPRESÁRIOS DO NORDESTE LTDA - UNICRED DO NORDESTE",0,-
33667205,"COOPERATIVA CENTRAL DE CRÉDITO, POUPANÇA E INVESTIMENTO DO CENTRO NORTE DO BRASIL - CENTRAL SICREDI CENTRO NORTE",0,-
65635377,NGO ASSOCIADOS CORRETORA DE CÂMBIO LTDA.,0,-
65645137,DASCAM CORRETORA DE CÂMBIO LTDA.,0,-
9512542,CODEPE CORRETORA DE VALORES E CÂMBIO S.A.,0,-
57996878,COOPERATIVA DE CRÉDITO DOS EMPREGADOS DO GRUPO AKZO NOBEL BRASIL - COOP AKZONOBEL,0,-
41255225,COOPERATIVA DE CRÉDITO SICREDI CENTRO PERNAMBUCANA,0,-
2332886,"XP INVESTIMENTOS CORRETORA DE CÂMBIO,TÍTULOS E VALORES MOBILIÁRIOS S/A",0,-
3400651,COOPERATIVA DE ECONOMIA E CRÉDITO MÚTUO DOS EMPREGADOS DA EMPRESA SUPERMERCADOS JAU SERVE - COOPERJS,0,-
58022195,COPERCRED - COOPERATIVA DE ECONOMIA E CRÉDITO MÚTUO DOS EMPREGADOS DAS EMPRESAS ZILLO LORENZETTI,0,-
58158387,"DIRECAO S.A. CREDITO, FINANCIAMENTO E INVESTIMENTO",0,-
78907607,"COOPERATIVA DE CRÉDITO, POUPANÇA E INVESTIMENTO CENTRO SUL - SICREDI CENTRO SUL PR/SC/RJ",0,-
3033469,COOPERATIVA DE CREDITO DO PLANALTO SUL - SICOOB CREDISSERRANA,0,-
913314,COOPERATIVA DE ECONOMIA E CRÉDITO MÚTUO DOS EMPREGADOS DA MAGNESITA REFRATÁRIOS S.A. LTDA. - CECREM,0,-
42066258,RJI CORRETORA DE TITULOS E VALORES MOBILIARIOS LTDA,0,-
5956581,"ATRIA S.A.- CRÉDITO, FINANCIAMENTO E INVESTIMENTO",0,-
42100982,COOPERATIVA DE ECONOMIA E CREDITO MUTUO DOS SERVIDORES DA EMPRESA BRASILEIRA DE CORREIOS E TELEGRAFOS LTDA,0,-
62090873,STONEX DISTRIBUIDORA DE TÍTULOS E VALORES MOBILIÁRIOS LTDA.,0,-
1259518,COOPERATIVA DE CRÉDITO DE LIVRE ADMISSÃO SICOOB UNIMAIS CENTRO LESTE PAULISTA - SICOOB UNIMAIS CENTRO LESTE PAULISTA,0,-
8844074,COOPERATIVA DE CRÉDITO DE ITAPETININGA - SICOOB CRED-ACI,0,-
36113876,OLIVEIRA TRUST DISTRIBUIDORA DE TÍTULOS E VALORES MOBILIARIOS S.A.,0,-
15122605,LÚMINA CORRETORA DE CÂMBIO LTDA.,0,-
1608685,COOPERATIVA DE CRÉDITO DE LIVRE ADMISSÃO DO ESTADO DO ACRE LTDA.,0,-
4649337,COOPERATIVA DE CRÉDITO DE LIVRE ADMISSÃO DFMIL LTDA. - SICOOB DFMIL,0,-
33851064,DILLON S/A DISTRIBUIDORA DE TITULOS E VALORES MOBILIARIOS,0,-
33264668,BANCO XP S.A.,0,-
4985665,CREDISIS OESTE - COOPERATIVA DE CRÉDITO E INVESTIMENTO DO OESTE,0,-
10736214,"COOPERATIVA DE CRÉDITO, POUPANÇA E INVESTIMENTO DO PLANALTO CENTRAL - SICREDI PLANALTO CENTRAL",0,-
3985375,CREDISIS SUDOESTE/RO - COOPERATIVA DE CRÉDITO E INVESTIMENTO DO SUDOESTE DE RONDÔNIA,0,-
9330158,COOPERATIVA DE CREDITO E ECONOMIA COM INTERAÇÃO SOLIDÁRIA - CRESOL TREZE DE MAIO,0,-
95213211,"COOPERATIVA DE CRÉDITO, POUPANÇA E INVESTIMENTO CAMINHO DAS ÁGUAS RS - SICREDI CAMINHO DAS ÁGUAS RS",0,-
4998845,"COOPERATIVA DE ECONOMIA E CRÉDITO MÚTUO DOS EMPREGADOS DA MINERACÃO RIO DO NORTE S/A, EM PORTO TROMBETAS LIMITADA -  CREDNORTE",0,-
36321990,"AGORACRED S/A SOCIEDADE DE CRÉDITO, FINANCIAMENTO E INVESTIMENTO",0,-
27652684,GENIAL INVESTIMENTOS CORRETORA DE VALORES MOBILIÁRIOS S.A.,0,-
731320,COOPERATIVA DE ECONOMIA E CRÉDITO MÚTUO DOS FUNCIONÁRIOS DA MORLAN - CRED MORLAN,0,-
8520517,SOL CORRETORA DE CÂMBIO LTDA.,0,-
4321309,COOPERATIVA DE CRÉDITO DOS SERVIDORES PÚBLICOS NO ESTADO DA BAHIA LTDA. - SICOOB CRED EXECUTIVO,0,-
2853045,COOPERATIVA DE ECONOMIA E CREDITO MUTUO DOS MEDICOS E DEMAIS PROFISSIONAIS DA SAUDE DE JOACABA,0,-
90278987,COOPERATIVA DE ECONOMIA E CREDITO MUTUO DOS SERVIDORES DA ASCAR/EMATER-RS LTDA-CRESAL,0,-
4323351,MORGAN STANLEY CORRETORA DE TÍTULOS E VALORES MOBILIÁRIOS S.A.,0,-
9105360,ICAP DO BRASIL CORRETORA DE TÍTULOS E VALORES MOBILIÁRIOS LTDA.,0,-
4152107,COOPERATIVA DE ECONOMIA E CRÉDITO MÚTUO DOS SERVIDORES DA POLÍCIA MILITAR DO ESTADO DE SÃO PAULO DA REGIÃO CENTRO-OESTE PAULISTA - CREDMIL,0,-
90497256,"COOPERATIVA DE CRÉDITO, POUPANÇA E INVESTIMENTO INTERESTADOS - SICREDI INTERESTADOS RS/ES",0,-
3566655,"COOPERATIVA DE CRÉDITO, POUPANÇA E INVESTIMENTO CELEIRO CENTRO OESTE - SICREDI CELEIRO CENTRO OESTE",0,-
7494300,"COOPERATIVA DE ECONOMIA E CRÉDITO MÚTUO DOS TRABALHADORES NA ÁREA DE SAÚDE, AFINS E EMPRESÁRIOS VINCULADOS À ACCI DE ERECHIM-RS-CREDISUL",0,-
30949267,COOPERATIVA DE ECONOMIA E CREDITO MUTUO DOS EMPREGADOS DE CHOCOLATES GAROTO LTDA. - CREDI-GAROTO,0,-
7789195,COOPERATIVA DE CRÉDITO DE LIVRE ADMISSÃO E DOS TRANSPORTADORES RODOVIÁRIOS DE VEÍCULOS - SICOOB CREDCEG,0,-
60779196,"CREFISA S.A.-CREDITO, FINANCIAMENTO E INVESTIMENTOS",0,-
336036,COINVALORES CORRETORA DE CÂMBIO E VALORES MOBILIÁRIOS LTDA.,0,-
40353377,FOURTRADE CORRETORA DE CÂMBIO LTDA.,0,-
57440521,COOPERATIVA DE ECONOMIA E CRÉDITO MÚTUO DOS FUNCIONÁRIOS DA TICKET SERVIÇOS COMÉRCIO E ADMINISTRAÇÃO,0,-
21797311,COOPERATIVA DE CRÉDITO DOS SERVIDORES DOS PODERES LEGISLATIVOS DO ESTADO DE MINAS GERAIS E DO SEU ÓRGÃO AUXILIAR E DE LIVRE ADMISSÃO LTDA. - SICOOB COFAL,0,-
61747085,TULLETT PREBON BRASIL CORRETORA DE VALORES E CÂMBIO LTDA,0,-
707903,COOPERATIVA DE CRÉDITO VALE DO CANOAS - SICOOB/SC CREDICANOAS,0,-
16944141,BROKER BRASIL CORRETORA DE CÂMBIO LTDA.,0,-
1637949,COOPERATIVA DE CRÉDITO DE LIVRE ADMISSÃO DO VALE DO PARANAPANEMA,0,-
77984870,"COOPERATIVA DE CRÉDITO, POUPANÇA E INVESTIMENTO TERRA DOS PINHEIRAIS DO PARANÁ E NOROESTE PAULISTA - SICREDI PLANALTO DAS ÁGUAS PR/SP",0,-
34978626,INTEGRAL ACCESS DISTRIBUIDORA DE TÍTULOS E VALORES MOBILIÁRIOS LTDA.,0,-
57598120,COOPERATIVA DE ECONOMIA E CRÉDITO MÚTUO DOS EMPREGADOS DO GRUPO TELEFÔNICA,0,-
89990501,"COOPERATIVA DE CRÉDITO, POUPANÇA E INVESTIMENTO DE IBIRAIARAS - SICREDI IBIRAIARAS RS/MG",0,-
18145784,NUMATUR CORRETORA DE CÂMBIO LTDA.,0,-
52623311,COOPERATIVA DE CRÉDITO RURAL DOS PLANTADORES DE CANA DA REGIÃO DE IGARAPAVA,0,-
3750034,"COOPERATIVA DE CRÉDITO, POUPANÇA E INVESTIMENTO DOS JUÍZES E CARREIRAS PÚBLICAS DO DIREITO DO ESTADO DO RIO GRANDE DO SUL - SICREDI AJURIS RS",0,-
89784367,EBADIVAL - E. BAGGIO DISTRIBUIDORA DE TÍTULOS E VALORES MOBILIÁRIOS LTDA.,0,-
1658426,COOPERFORTE - COOPERATIVA DE ECONOMIA E CRÉDITO MÚTUO DE FUNCIONÁRIOS DE INSTITUIÇÕES FINANCEIRAS PÚBLICAS FEDERAIS LTDA.,0,-
52935442,COOPERATIVA DE ECONOMIA E CRÉDITO MÚTUO ALIANÇA - COOPERNITRO,0,-
2276653,TRINUS CAPITAL DISTRIBUIDORA DE TÍTULOS E VALORES MOBILIÁRIOS S.A.,0,-
49091119,COOPERATIVA DE CRÉDITO MÚTUO DOS EMPREGADOS DA SKF E COLIGADAS,0,-
33416108,"COOPERATIVA CENTRAL DE CRÉDITO DE GOIÁS, DISTRITO FEDERAL E TOCANTINS LTDA. - SICOOB NOVA CENTRAL",0,-
23241540,CREBEL - COOPERATIVA DE ECONOMIA E CRÉDITO MÚTUO DOS COLABORADORES DAS EMPRESAS BELGO BEKAERT - CREBEL LTDA.,0,-
3535065,COOPERATIVA DE CRÉDITO SICOOB CREDMETAL,0,-
89468565,"COOPERATIVA DE CRÉDITO, POUPANÇA E INVESTIMENTO DA REGIÃO DA PRODUÇÃO - SICREDI REGIÃO DA PRODUÇÃO RS/SC/MG",0,-
58017179,BANCO VOLVO BRASIL S.A.,0,-
997185,BANCO B3 S.A.,0,-
45056494,MARMARIS CORRETORA DE CÂMBIO LTDA.,0,-
44077014,BR-CAPITAL DISTRIBUIDORA DE TÍTULOS E VALORES MOBILIÁRIOS S.A.,0,-
204963,COOPERATIVA DE CREDITO RURAL SEARA - CREDISEARA,0,-
15482499,TURCÂMBIO - CORRETORA DE CÂMBIO LTDA.,0,-
2833202,COOPERATIVA DE CRÉDITO DE LIVRE ADMISSÃO DE VITÓRIA DA CONQUISTA,0,-
1062439,COOPERATIVA DE ECONOMIA E CREDITO MUTUO DOS FUNCIONARIOS DA COMIGO,0,-
25683434,COOPERATIVA CENTRAL DE CRÉDITO DE MINAS GERAIS LTDA. - SICOOB CENTRAL CREDIMINAS,0,-
33886862,"MASTER S/A CORRETORA DE CÂMBIO, TÍTULOS E VALORES MOBILIÁRIOS",0,-
6077760,COOPERATIVA DE CRÉDITO MÚTUO DOS FUNCIONÁRIOS DA RICLAN,0,-
2541707,COOPERATIVA DE ECONOMIA E CRÉDITO MÚTUO DOS FUNCIONÁRIOS DAS EMPRESAS DE CERÂMICA - COOPASPACER,0,-
87781530,"COOPERATIVA DE CRÉDITO, POUPANÇA E INVESTIMENTO INTEGRAÇÃO DE ESTADOS DO RIO GRANDE DO SUL, SANTA CATARINA E MINAS GERAIS - SICREDI INTEGRAÇÃO DE ESTADOS RS/SC/MG",0,-
72600026,RIO BRAVO INVESTIMENTOS - DISTRIBUIDORA DE TÍTULOS E VALORES MOBILIÁRIOS LTDA.,0,-
19086249,EXECUTIVE CORRETORA DE CÂMBIO LTDA.,0,-
67600379,ANDBANK DISTRIBUIDORA DE TÍTULOS E VALORES MOBILIÁRIOS LTDA.,0,-
15761217,CORRETORA DE CÂMBIO AÇORIANA LIMITADA.,0,-
46955383,QI DISTRIBUIDORA DE TÍTULOS E VALORES MOBILIÁRIOS LTDA.,0,-
91884981,BANCO JOHN DEERE S.A.,0,-
2448839,COOPERATIVA DE CRÉDITO DE RIO RUFINO - SICOOB CREDIUNIÃO,0,-
2923389,"COOPERATIVA DE CRÉDITO, POUPANÇA E INVESTIMENTO SICREDI ARACAJU - SICREDI ARACAJU",0,-
40333582,PROSEFTUR CORRETORA DE CAMBIO S.A,0,-
3485130,COOPERATIVA DE CRÉDITO E ECONOMIA COM INTERAÇÃO SOLIDÁRIA - CRESOL ENCOSTAS DA SERRA GERAL,0,-
69136075,COOPERATIVA DE ECONOMIA E CRÉDITO MÚTUO DOS SERVIDORES DA UNESP - COOPUNESP,0,-
32467086,COOPERATIVA DE CRÉDITO SUL DO ESPÍRITO SANTO - SICOOB SUL,0,-
81014060,COOPERATIVA DE CREDITO DE LIVRE ADMISSÃO DE ASSOCIADOS ITAIPU SICOOB CREDITAIPU,0,-
32474884,COOPERATIVA DE CRÉDITO SUL-LITORÂNEA DO ESPÍRITO SANTO,0,-
5269976,COOPERATIVA DE CRÉDITO E ECONOMIA COM INTERAÇÃO SOLIDÁRIA DE FORMOSA DO SUL - CRESOL FORMOSA,0,-
32422628,COOPERATIVA DE CREDITO RURAL DE GUACUI - CREDIGUAÇUÍ,0,-
32428294,COOPERATIVA CENTRAL DE CREDITO DO ESPIRITO SANTO - SICOOB CENTRAL ES,0,-
1389651,COOPERATIVA DE CRÉDITO DE LIVRE ADMISSÃO DE ASSOCIADOS DO PLANALTO CATARINENSE SICOOB CREDIPLANALTO SC/RS,0,-
15168152,CONSEGTUR CORRETORA DE CÂMBIO LTDA.,0,-
81192106,"COOPERATIVA DE CRÉDITO, POUPANÇA E INVESTIMENTO NOSSA TERRA - SICREDI NOSSA TERRA PR/SP",0,-
7679404,BANCO TOPÁZIO S.A.,0,-
5289612,ASPECIR - SOCIEDADE DE CRÉDITO AO MICROEMPREENDEDOR E À EMPRESA DE PEQUENO PORTE LTDA.,0,-
81054686,"COOPERATIVA DE CRÉDITO, POUPANÇA E INVESTIMENTO INTEGRAÇÃO - SICREDI INTEGRAÇÃO PR/SC",0,-
81099491,"COOPERATIVA DE CRÉDITO, POUPANÇA E INVESTIMENTO VALE DO PIQUIRI ABCD - SICREDI VALE DO PIQUIRI ABCD PR/SP",0,-
8041950,"COOPERATIVA DE CRÉDITO, POUPANÇA E INVESTIMENTO DO SISTEMA DE JUSTIÇA NO ESTADO DO CEARÁ - SICREDI COOPERJURIS",0,-
69346856,COOPERATIVA DE ECONOMIA E CRÉDITO MÚTUO DOS PROFISSIONAIS DA SAÚDE DA REGIÃO DA ALTA MOGIANA - SICOOB CREDIMOGIANA,0,-
81206039,"COOPERATIVA DE CREDITO, POUPANÇA E INVESTIMENTO RIO PARANA - SICREDI RIO PARANA PR/SP",0,-
92555150,"COOPERATIVA DE CRÉDITO, POUPANÇA E INVESTIMENTO DA REGIÃO ALTOS DA SERRA - SICREDI ALTOS DA SERRA RS/SC",0,-
87733077,"COOPERATIVA DE CRÉDITO, POUPANÇA E INVESTIMENTO ESSÊNCIA RS/ES - SICREDI ESSÊNCIA",0,-
3645752,COOPERATIVA DE CRÉDITO CREDISG LTDA. - SICOOB CREDISG,0,-
24654881,"COOPERATIVA DE CRÉDITO, POUPANÇA E INVESTIMENTO UNIÃO DOS ESTADOS DE MATO GROSSO DO SUL, TOCANTINS E OESTE DA BAHIA - SICREDI UNIÃO MS/TO",0,-
5790149,CENTRAL COOPERATIVA DE CRÉDITO NO ESTADO DO ESPÍRITO SANTO - CECOOP,0,-
5969937,COOPERATIVA DE CRÉDITO MÚTUO DOS SERVIDORES MUNICIPAIS DE BEBEDOURO - COOCRESB.,0,-
28650236,BS2 DISTRIBUIDORA DE TÍTULOS E VALORES MOBILIÁRIOS S.A.,0,-
37229413,"SOCIEDADE DE CRÉDITO, FINANCIAMENTO E INVESTIMENTO EFÍ S.A.",0,-
34666362,MONOPÓLIO CORRETORA DE CÂMBIO LTDA.,0,-
71965313,COOPERATIVA DE ECONOMIA E CRÉDITO MÚTUO DOS FUNCIONÁRIOS DO FLEURY,0,-
2015588,COOPERATIVA DE CRÉDITO DE LIVRE ADMISSÃO DO CENTRO SUL RONDONIENSE - SICOOB CREDIP.,0,-
968602,COOPERATIVA DE CREDITO DE LIVRE ADMISSÃO DO VALE DO SÃO PATRICIO LTDA.,0,-
72128440,"COOPERATIVA DE CREDITO, POUPANCA E INVESTIMENTO DO RIO DE JANEIRO - SICREDI RIO RJ",0,-
80202872,CORREPARTI CORRETORA DE CAMBIO LTDA,0,-
32062580,BANCO CREDIT SUISSE (BRASIL) S.A.,0,-
62264924,CP & FRIZZO - DISTRIBUIDORA DE TÍTULOS E VALORES MOBILIÁRIOS LTDA,0,-
3065046,"COOPERATIVA DE CRÉDITO, POUPANÇA E INVESTIMENTO DO NOROESTE DO ESTADO DE SÃO PAULO - SICREDI NOROESTE SP",0,-
1330387,COOPERATIVA DE CRÉDITO RURAL DE PEQUENOS AGRICULTORES E DA REFORMA AGRÁRIA DO CENTRO OESTE DO PARANÁ - CREHNOR LARANJEIRAS,0,-
25280945,AVS CORRETORA DE CÂMBIO LTDA.,0,-
62280490,DIBRAN DISTRIBUIDORA DE TÍTULOS E VALORES MOBILIÁRIOS LTDA.,0,-
25387655,COOPERATIVA DE CRÉDITO CREDIVALE LTDA - SICOOB CREDIVALE,0,-
8673569,F.D'GOLD - DISTRIBUIDORA DE TÍTULOS E VALORES MOBILIÁRIOS LTDA.,0,-
10853017,GET MONEY CORRETORA DE CÂMBIO S.A.,0,-
18539102,CHG-MERIDIAN DO BRASIL ARRENDAMENTO MERCANTIL S.A.,0,-
28145589,CRETOVALE - COOPERATIVA DE ECONOMIA E CRÉDITO MÚTUO DOS TRABALHADORES DA VALE,0,-
37255049,SICOOB CREDIGOIÁS COOPERATIVA DE CRÉDITO LTDA.,0,-
4694278,COOPERATIVA DE ECONOMIA E CRÉDITO MÚTUO DOS INTEGRANTES DO MINISTÉRIO PÚBLICO E DA DEFENSORIA PÚBLICA NO ESTADO DO RIO DE JANEIRO LIMITADA. - SICOOB COMPERJ,0,-
17315359,SITA SOCIEDADE CORRETORA DE CAMBIO E VALORES MOBILIARIOS S.A,0,-
10548608,COOPERATIVA DE CRÉDITO DE SERVIDORES DA UESC - UESCOOP,0,-
37442605,"COOPERATIVA DE CRÉDITO, POUPANÇA E INVESTIMENTO NORTE MATO-GROSSENSE E OESTE PARAENSE - SICREDI GRANDES RIOS MT/PA/AM",0,-
17352220,SENSO CORRETORA DE CAMBIO E VALORES MOBILIARIOS S.A,0,-
5036532,CENTRAL DAS COOPERATIVAS DE CREDITO UNICOOB - SICOOB CENTRAL UNICOOB,0,-
41592532,MÉRITO DISTRIBUIDORA DE TÍTULOS E VALORES MOBILIÁRIOS LTDA.,0,-
37631058,COOPERATIVA DE CRÉDITO DE LIVRE ADMISSÃO DE PALMEIRAS E REGIÃO LTDA.,0,-
5040680,COOPERATIVA DE CRÉDITO DOS MAGISTRADOS DO ESTADO DO RIO DE JANEIRO LTDA. - MAGICREDI-RJ,0,-
4862600,"PORTOSEG S.A. - CREDITO, FINANCIAMENTO E INVESTIMENTO",0,-
4478231,COOPERATIVA DE ECONOMIA E CRÉDITO MÚTUO DOS MEMBROS DO MINISTÉRIO PÚBLICO DE SÃO PAULO - PROMOCRED,0,-
47944277,COOPERATIVA DE ECONOMIA E CRÉDITO MÚTUO DOS EMPREGADOS DA JOYSON SAFETY SYSTEMS - COOPERJSS,0,-
68969625,COOPERATIVA DE ECONOMIA E CRÉDITO MÚTUO DOS EMPREGADOS DAS EMPRESAS CONTROLADAS E COLIGADAS DA USINA SANTA ADELIA - USAGRO,0,-
7554076,CGD INVESTIMENTOS CORRETORA DE VALORES E CÂMBIO S.A.,0,-
91586982,"COOPERATIVA DE CRÉDITO, POUPANÇA E INVESTIMENTO SICREDI PIONEIRA RS - SICREDI PIONEIRA RS",0,-
34711571,VITREO DISTRIBUIDORA DE TÍTULOS E VALORES MOBILIÁRIOS S.A.,0,-
11476673,BANCO RANDON S.A.,0,-
43050917,"ACTIVTRADES CORRETORA DE CÂMBIO, TÍTULOS E VALORES MOBILIÁRIOS LTDA.",0,-
74220948,SICOOB UNISP - COOPERATIVA DE CRÉDITO,0,-
2663426,COOPERATIVA DE CRÉDITO E ECONOMIA COM INTERAÇÃO SOLIDÁRIA - CRESOL NOROESTE,0,-
3609817,BANCO CARGILL S.A.,0,-
74248949,COOPERATIVA DE CRÉDITO MÚTUO DOS SERVIDORES MUNICIPAIS DE SÃO JOÃO DA BOA VISTA - CREDIVISTA,0,-
95424891,"COOPERATIVA DE CRÉDITO, POUPANÇA E INVESTIMENTO DO VALE DO RIO PARDO - SICREDI VALE DO RIO PARDO RS",0,-
1286361,UNIPRIME PIONEIRA COOPERATIVA DE CRÉDITO,0,-
87067757,"COOPERATIVA DE CRÉDITO, POUPANÇA E INVESTIMENTO CENTRO SERRA - SICREDI CENTRO SERRA RS",0,-
66262643,COOPERATIVA DE CRÉDITO CREDIPEU LTDA.  - SICOOB CREDIPEU,0,-
28048783,ELITE CORRETORA DE CÂMBIO E VALORES MOBILIÁRIOS LTDA,0,-
87437687,"COOPERATIVA CENTRAL DE CRÉDITO, POUPANÇA E INVESTIMENTO DO SUL E SUDESTE - CENTRAL SICREDI SUL/SUDESTE",0,-
74828799,NOVO BANCO CONTINENTAL S.A. - BANCO MÚLTIPLO,0,-
10749264,GDC PARTNERS SERVIÇOS FIDUCIÁRIOS DISTRIBUIDORA DE TÍTULOS E VALORES MOBILIÁRIOS LTDA.,0,-
4684647,"ARC CORRETORA DE CAMBIO, ASSOCIADOS GOUVEIA, CAMPEDELLI S.A.",0,-
5241145,COOPERATIVA DE CRÉDITO RURAL E ECONOMIA COM INTERAÇÃO SOLIDÁRIA DE GETÚLIO VARGAS - CRESOL GETÚLIO VARGAS,0,-
3632872,COOPERATIVA DE CRÉDITO DE LIVRE ADMISSÃO DO SUDOESTE DA AMAZÔNIA LTDA. - SICOOB CREDISUL.,0,-
3634220,BANCO HONDA S.A.,0,-
3634239,HONDA LEASING S.A. - ARRENDAMENTO MERCANTIL,0,-
17312661,AMARIL FRANKLIN CORRETORA DE TÍTULOS E VALORES LTDA,0,-
90729369,"COOPERATIVA DE CRÉDITO, POUPANÇA E INVESTIMENTO REGIÕES DAS CULTURAS - SICREDI DAS CULTURAS RS/MG",0,-
24074692,GUITTA CORRETORA DE CAMBIO LTDA.,0,-
79052122,"COOPERATIVA DE CREDITO, POUPANÇA E INVESTIMENTO ALIANÇA - SICREDI ALIANÇA PR/SP",0,-
79086997,"COOPERATIVA DE CRÉDITO, POUPANÇA E INVESTIMENTO PARANAPANEMA PR/SP - SICREDI PARANAPANEMA PR/SP",0,-
5740092,COOPERATIVA DE CRÉDITO DOS METALÚRGICOS DO ABC - CREDABC,0,-
31597552,BANCO CLASSICO S.A.,0,-
91018408,COOPERATIVA DE ECONOMIA E CRÉDITO MÚTUO DOS FUNCIONÁRIOS DAS EMPRESAS DO GRUPO DANA - COOPDANA,0,-
1709266,COOPERATIVA DE CRÉDITO MÚTUO DOS PROFISSIONAIS DA SAÚDE E LIVRE ADMISSÃO DE TEÓFILO OTONI LTDA. - UNICRED TRÊS VALES,0,-
13220493,BR PARTNERS BANCO DE INVESTIMENTO S.A.,0,-
3422007,COOPERATIVA DE CRÉDITO DOS BANCÁRIOS DE SÃO PAULO E MUNICÍPIOS LIMÍTROFES,0,-
4831810,COOPERATIVA DE ECONOMIA E CREDITO MUTUO DOS SERVIDORES PUBLICOS DE PINHÃO - CRESERV-PINHÃO,0,-
79342069,"COOPERATIVA DE CRÉDITO, POUPANÇA E INVESTIMENTO DEXIS - SICREDI DEXIS",0,-
53776852,COOPERATIVA DE CREDITO DOS FORNECEDORES DE CANA E DEMAIS PRODUTORES RURAIS DO CENTRO DO ESTADO DE SAO PAULO - CREDICENTRO,0,-
91159764,"COOPERATIVA DE CRÉDITO, POUPANÇA E INVESTIMENTO DE LAJEADO - SICREDI INTEGRAÇÃO RS/MG",0,-
1727929,COOPERATIVA DE CRÉDITO UNICRED EVOLUÇÃO LTDA. - UNICRED EVOLUÇÃO,0,-
