Cnpj,RazaoSocial,ValorMaximo,Periodicidade
80202872,CORREPARTI CORRETORA DE CAMBIO LTDA,2000,Por evento
4062902,OZ CORRETORA DE CÂMBIO S.A.,1500,Por evento
4833655,COOPERATIVA DE ECONOMIA E CRÉDITO MÚTUO SICOOB METALCRED,500,Por evento
68900810,BANCO RENDIMENTO S.A.,350,Por evento
78632767,BANCO OURINVEST S.A.,350,Por evento
14388334,PARANÁ BANCO S.A.,350,Por evento
13728156,WESTERN UNION CORRETORA DE CÂMBIO S.A.,250,Por evento
13720915,BANCO WESTERN UNION DO BRASIL S.A.,250,Por evento
25606237,COOPERATIVA DE POUPANÇA E CRÉDITO DO VALE DO RIO DOCE LTDA - SICOOB CREDIRIODOCE,200,Por evento
250699,AGK CORRETORA DE CAMBIO S.A.,200,Por evento
13059145,BEXS BANCO DE CÂMBIO S/A,200,Por evento
40353377,FOURTRADE CORRETORA DE CÂMBIO LTDA.,200,Por evento
52937216,BEXS CORRETORA DE CÂMBIO S/A,200,Por evento
45056494,MARMARIS CORRETORA DE CÂMBIO LTDA.,200,Por evento
7679404,BANCO TOPÁZIO S.A.,200,Por evento
30183111,TROCKA CORRETORA DE CAMBIO LTDA.,200,Por evento
62285390,SINGULARE CORRETORA DE TÍTULOS E VALORES MOBILIÁRIOS S.A.,200,Por evento
4913129,CONFIDENCE CORRETORA DE CÂMBIO S.A.,100,Por evento
41931445,COOPERATIVA DE CRÉDITO CREDIFOR LTDA - SICOOB CREDIFOR,100,Por evento
58497702,BANCO LETSBANK S.A.,100,Por evento
11703662,TRAVELEX BANCO DE CÂMBIO S.A.,100,Por evento
460065,COLUNA S/A DISTRIBUIDORA DE TITULOS E VALORES MOBILIÁRIOS,100,Por evento
3443143,AVIPAM CORRETORA DE CAMBIO LTDA,100,Por evento
78834975,COOPERATIVA DE CRÉDITO DE LIVRE ADMISSÃO DE ASSOCIADOS DO VALE DO CANOINHAS - SICOOB CREDICANOINHAS/SC,100,Por evento
2641969,COOPERATIVA DE CRÉDITO DE LIVRE ADMISSÃO DE ASSOCIADOS NOVA TRENTO   SICOOB TRENTOCREDI SC,100,Por evento
58160789,BANCO SAFRA S.A.,99,Por evento
62232889,BANCO DAYCOVAL S.A.,"81,31",Por evento
17354911,COTACAO DISTRIBUIDORA DE TITULOS E VALORES MOBILIARIOS S.A,60,Por evento
0,BANCO DO BRASIL S.A.,50,Por evento
17904906,BRX CORRETORA DE CÂMBIO LTDA.,50,Por evento
71027866,BANCO BS2 S.A.,40,Por evento
86564051,COOPERATIVA DE CRÉDITO NOROESTE DE MINAS LTDA. - SICOOB NOROESTE DE MINAS,35,Por evento
90400888,BANCO SANTANDER (BRASIL) S.A.,30,Por evento
8609934,MONEYCORP BANCO DE CÂMBIO S.A.,30,Por evento
60701190,ITAÚ UNIBANCO S.A.,30,Por evento
17312083,H H PICCHIONI S/A CORRETORA DE CAMBIO E VALORES MOBILIARIOS,30,Por evento
70937271,COOPERATIVA DE CRÉDITO DOS PROFISSIONAIS DA ÁREA DA SAÚDE E DE LIVRE ADMISSÃO LTDA - UNICRED ALIANÇA,30,Por evento
92702067,BANCO DO ESTADO DO RIO GRANDE DO SUL S.A.,30,Por evento
60746948,BANCO BRADESCO S.A.,25,Por evento
5442029,CASA DO CRÉDITO S.A. SOCIEDADE DE CRÉDITO AO MICROEMPREENDEDOR,25,Por evento
32615247,COOPERATIVA DE CREDITO SICOOB COOPEC LTDA.,23,Por evento
1705236,COOPERATIVA DE ECONOMIA E CRÉDITO MÚTUO UNICRED PROSPERAR LTDA. - UNICRED PROSPERAR,20,Por evento
94243839,COOPERATIVA DE ECONOMIA E CRÉDITO MÚTUO DO VALE DAS ANTAS LTDA. - UNICRED PIONEIRA,20,Por evento
94433109,COOPERATIVA DE ECONOMIA E CREDITO MUTUO DOS MEDICOS DE PORTO ALEGRE LTDA-UNICRED PORTO ALEGRE,20,Por evento
1634601,COOPERATIVA CENTRAL DE CRÉDITO UNICRED GERAÇÃO LTDA. - UNICRED CENTRAL GERAÇÃO,20,Por evento
1635462,COOPERATIVA DE ECONOMIA E CRÉDITO MÚTUO DOS MÉDICOS DOS VALES DO TAQUARI E RIO PARDO E REGIÃO DA PRODUÇÃO LTDA. - UNICRED PREMIUM,20,Por evento
95163002,COOPERATIVA DE ECONOMIA E CRÉDITO MÚTUO UNICRED ELEVA LTDA.,20,Por evento
1572667,COOPERATIVA DE ECONOMIA E CRÉDITO MÚTUO UNICRED ERECHIM LTDA,20,Por evento
1090027,COOPERATIVA DE ECONOMIA E CREDITO MUTUO DOS MEDICOS E CATEGORIAS AFINS-UNICRED NITEROI LTDA,20,Por evento
92935741,COOPERATIVA DE ECONOMIA E CRÉDITO MÚTUO DOS EMPREGADOS DO BANRISUL,20,Por evento
1796302,COOPERATIVA DE CRÉDITO UNICRED REGIÃO DOS VALES LTDA. - UNICRED REGIÃO DOS VALES,20,Por evento
1526924,COOPERATIVA DE ECONOMIA E CRÉDITO MÚTUO UNICRED HORIZONTES LTDA - UNICRED HORIZONTES,20,Por evento
73750424,COOPERATIVA DE ECONOMIA E CRÉDITO MÚTUO UNICRED INTEGRAÇÃO LTDA.,20,Por evento
25280945,AVS CORRETORA DE CÂMBIO LTDA.,20,Por evento
2641032,COOPERATIVA DE ECONOMIA E CRÉDITO MÚTUO UNICRED PONTO CAPITAL - UNICRED PONTO CAPITAL.,20,Por evento
73326449,COOPERATIVA DE CRÉDITO DE LIVRE ADMISSÃO DE ASSOCIADOS - SICOOB CRUZ ALTA,20,Por evento
36900256,"COOPERATIVA DE CRÉDITO DOS MÉDICOS, PROFISSIONAIS DA SAÚDE E EMPRESÁRIOS DE MATO GROSSO",20,Por evento
39231527,UNICRED COSTA DO SOL RJ - COOPERATIVA DE ECONOMIA E CRÉDITO MÚTUO LTDA.,20,Por evento
4445917,UNICRED REGIONAL NORTE LAGOS - COOPERATIVA DE ECONOMIA E CRÉDITO MÚTUO REGIONAL NORTE LAGOS LTDA,20,Por evento
869687,COOPERATIVA DE CRÉDITO DE LIVRE ADMISSÃO DE BOA ESPERANÇA LTDA. - SICOOB BELCREDI,18,Por evento
18966739,COOPERATIVA DE CRÉDITO COPERSUL LTDA - SICOOB COPERSUL,12,Por evento
15077393,MEGA CORRETORA DE CÂMBIO LTDA.,10,Por evento
9463721,COOPERATIVA DE CREDITO E ECONOMIA COM INTERAÇÃO SOLIDÁRIA - CRESOL JACINTO MACHADO,"7,4",Por evento
23010182,GOOD CORRETORA DE CÂMBIO LTDA,7,Por evento
2493000,"COOPERATIVA DE ECONOMIA E CRÉDITO MÚTUO NOS ESTADOS DE ALAGOAS, SERGIPE E BAHIA - SICOOB LESTE",0,-
37554441,COOPERATIVA DE CRÉDITO SICOOB UNI SUL MS,0,-
51489318,COOPERATIVA DE ECONOMIA E CRÉDITO MÚTUO DOS MAGISTRADOS DE SÃO PAULO - MAGISCRED,0,-
7656500,BANCO KDB DO BRASIL S.A.,0,-
2801938,BANCO MORGAN STANLEY S.A.,0,-
42272526,BNY MELLON BANCO S.A.,0,-
2992317,TREVISO CORRETORA DE CÂMBIO S.A.,0,-
4355489,COOPERATIVA DE CRÉDITO UNICRED COOMARCA LTDA. - COOMARCA,0,-
73622748,B&T CORRETORA DE CAMBIO LTDA.,0,-
71328769,SICOOB COCRED COOPERATIVA DE CRÉDITO,0,-
25683475,COOPERATIVA DE CRÉDITO DE LIVRE ADMISSÃO DO VALE DO RIO GRANDE LTDA. - SICOOB UBERABA,0,-
26014175,COOPERATIVA DE CRÉDITO GUARANICREDI LTDA. - SICOOB GUARANICREDI,0,-
92856905,ADVANCED CORRETORA DE CÂMBIO LTDA,0,-
42873828,COOPERATIVA DE CRÉDITO AGROCREDI LTDA. - SICOOB AGROCREDI,0,-
10866788,BANCO BANDEPE S.A.,0,-
74220948,SICOOB UNISP - COOPERATIVA DE CRÉDITO,0,-
46642294,COOPERATIVA DE CRÉDITO MÚTUO DOS EMPREGADOS DA EMBRAER - COOPEREMB,0,-
71207740,COOPERATIVA DE CRÉDITO RURAL DE IRAÍ DE MINAS LTDA -SICOOB CREDIMIL,0,-
9512542,CODEPE CORRETORA DE VALORES E CÂMBIO S.A.,0,-
11495073,OM DISTRIBUIDORA DE TÍTULOS E VALORES MOBILIÁRIOS LTDA,0,-
2275781,COOPERATIVA DE CRÉDITO MÚTUO DOS SERVIDORES FEDERAIS NA PARAÍBA - SICOOB COOPERCRET,0,-
3419786,COOPERATIVA DE CRÉDITO NOSSA SENHORA DO DESTERRO - SICOOB CREDISC,0,-
86389236,COOPERATIVA DE CRÉDITO SICOOB UNI SUDESTE,0,-
4247370,COOPERATIVA DE CRÉDITO DE EMPRESÁRIOS - SICOOB/TRANSCREDI,0,-
1259518,COOPERATIVA DE CRÉDITO DE LIVRE ADMISSÃO SICOOB UNIMAIS CENTRO LESTE PAULISTA - SICOOB UNIMAIS CENTRO LESTE PAULISTA,0,-
3620772,COOPERATIVA DE CRÉDITO MÚTUO DO CEARÁ - SICOOB CEARÁ,0,-
2382755,COOPERATIVA DE CREDITO POTIGUAR - SICOOB POTIGUAR,0,-
259231,SICOOB UNIMAIS METROPOLITANA - COOPERATIVA DE CRÉDITO DE LIVRE ADMISSÃO,0,-
43268960,COOPERATIVA DE ECONOMIA E CRÉDITO MÚTUO DOS FUNCIONÁRIOS DO GRUPO AVIBRAS - COOPER AVIBRAS,0,-
5591437,"COOPERATIVA DE ECONOMIA E CRÉDITO MÚTUO SERVIDORES PÚBLICOS ATIVOS, INATIVOS E PENSIONISTAS DA ADMINISTRAÇÃO DIRETA, INDIRETA E ASSEMBLÉIA LEGISLATIVA DO ESTADO DO RIO GRANDE SUL - COOPSERGS",0,-
17192451,BANCO ITAUCARD S.A.,0,-
19449602,COOPERATIVA DE CRÉDITO CREDCOOPER LTDA - SICOOB CREDCOOPER,0,-
64237530,COOPERATIVA DE CRÉDITO CREDIUNA LTDA - SICOOB CREDIUNA,0,-
27842177,"IB CORRETORA DE CÂMBIO, TÍTULOS E VALORES MOBILIÁRIOS S.A.",0,-
75847,COOPERATIVA DE CRÉDITO UNICRED CENTRO-SUL LTDA - UNICRED CENTRO-SUL,0,-
2528151,COOPERATIVA DE CRÉDITO SICOOB CREDCOOP LTDA.,0,-
7469260,COOPERATIVA DE CRÉDITO CREDIFIEMG LTDA. - SICOOB CREDIFIEMG,0,-
6132348,LABOR SOCIEDADE CORRETORA DE CÂMBIO LTDA.,0,-
12392983,"MIRAE ASSET WEALTH MANAGEMENT (BRAZIL) CORRETORA DE CÂMBIO, TÍTULOS E VALORES MOBILIÁRIOS LTDA.",0,-
73302408,EXIM CORRETORA DE CAMBIO LTDA,0,-
3732359,COOPERATIVA DE CRÉDITO DE LIVRE ADMISSÃO DE PERNAMBUCO - SICOOB PERNAMBUCO,0,-
73443863,COOPERATIVA DE CRÉDITO UNICRED VALE LTDA - UNICRED VALE,0,-
71163315,"COOPERATIVA DE CRÉDITO MÚTUO DOS PROFISSIONAIS DE NÍVEL SUPERIOR DA SAÚDE, ARQUITETOS E URBANISTAS DE SETE LAGOAS E REGIÃO LTDA - UNICRED SETE LAGOAS",0,-
7333726,ONNIX CORRETORA DE CÂMBIO LTDA.,0,-
71238232,COOPERATIVA DE CRÉDITO DO CENTRO SUL MINEIRO LTDA. - SICOOB CENTRO SUL MINEIRO,0,-
40434681,AZUMI DISTRIBUIDORA DE TÍTULOS E VALORES MOBILIÁRIOS LTDA.,0,-
76641497,DOURADA CORRETORA DE CÂMBIO LTDA.,0,-
7714057,COOPERATIVA DE ECONOMIA E CRÉDITO MÚTUO DOS PROFISSIONAIS DA ÁREA NOTARIAL E REGISTRAL - COOPNORE,0,-
34148882,COOPERATIVA CENTRAL DE CRÉDITO DA BAHIA LTDA - SICOOB CENTRAL BA,0,-
34265629,INTERCAM CORRETORA DE CÂMBIO LTDA.,0,-
1582158,OPPORTUNITY DISTRIBUIDORA DE TÍTULOS E VALORES MOBILIÁRIOS LTDA,0,-
32648370,FAIR CORRETORA DE CAMBIO S.A.,0,-
6373777,BOA VIAGEM SOCIEDADE CORRETORA DE CÂMBIO LTDA.,0,-
11417016,SCANIA BANCO S.A.,0,-
16854999,SINGRATUR CORRETORA DE CÂMBIO LTDA,0,-
40333582,PROSEFTUR CORRETORA DE CAMBIO S.A,0,-
83325811,CREDISIS COOPERUFPA - COOPERATIVA DE ECONOMIA E CRÉDITO MÚTUO DOS SERVIDORES PÚBLICOS FEDERAIS E ESTADUAIS E DAS ENTIDADES DE ENSINO COM SEUS RESPECTIVOS FUNCIONÁRIOS NO ESTADO DO PARÁ,0,-
41707258,COOPERATIVA DE CRÉDITO DE LIVRE ADMISSÃO DE SANTO ANTÔNIO DO MONTE LTDA.   SICOOB CREDIMONTE,0,-
9403026,COOPERATIVA DE CRÉDITO CENTRO LESTE NORTE MARANHENSE - SICOOB CENTROLESTE,0,-
28762249,SADOC SOCIEDADE CORRETORA DE CÂMBIO LTDA.,0,-
15122605,LÚMINA CORRETORA DE CÂMBIO LTDA.,0,-
27652684,GENIAL INVESTIMENTOS CORRETORA DE VALORES MOBILIÁRIOS S.A.,0,-
8520517,SOL CORRETORA DE CÂMBIO LTDA.,0,-
4323351,MORGAN STANLEY CORRETORA DE TÍTULOS E VALORES MOBILIÁRIOS S.A.,0,-
30723886,BANCO MODAL S.A.,0,-
16944141,BROKER BRASIL CORRETORA DE CÂMBIO LTDA.,0,-
61820817,BANCO PAULISTA S.A.,0,-
57598120,COOPERATIVA DE ECONOMIA E CRÉDITO MÚTUO DOS EMPREGADOS DO GRUPO TELEFÔNICA,0,-
18145784,NUMATUR CORRETORA DE CÂMBIO LTDA.,0,-
89784367,EBADIVAL - E. BAGGIO DISTRIBUIDORA DE TÍTULOS E VALORES MOBILIÁRIOS LTDA.,0,-
16927221,AMAZÔNIA CORRETORA DE CÂMBIO LTDA.,0,-
71590442,LASTRO RDV DISTRIBUIDORA DE TÍTULOS E VALORES MOBILIÁRIOS LTDA.,0,-
952415,COOPERATIVA DE CRÉDITO DE LIVRE ADMISSÃO CREDFAZ LTDA. - SICOOB CREDFAZ,0,-
62237649,CAROL DISTRIBUIDORA DE TITULOS E VALORES MOBILIARIOS LTDA.,0,-
1608685,COOPERATIVA DE CRÉDITO DE LIVRE ADMISSÃO DO ESTADO DO ACRE LTDA.,0,-
26526166,COOPERATIVA DE CRÉDITO DE LIVRE ADMISSÃO SUL MARANHENSE - SICOOB SUL MARANHENSE,0,-
3102185,"COOPERATIVA DE CRÉDITO DOS SERVIDORES DA UNIÃO, EMPRESÁRIOS, PROFISSIONAIS AUTÔNOMOS E LIBERAIS - SICOOB CENTRO NORDESTE",0,-
15482499,TURCÂMBIO - CORRETORA DE CÂMBIO LTDA.,0,-
18287740,CONECTA CORRETORA DE CÂMBIO LTDA.,0,-
2833202,COOPERATIVA DE CRÉDITO DE LIVRE ADMISSÃO DE VITÓRIA DA CONQUISTA,0,-
1062439,COOPERATIVA DE ECONOMIA E CREDITO MUTUO DOS FUNCIONARIOS DA COMIGO,0,-
25683434,COOPERATIVA CENTRAL DE CRÉDITO DE MINAS GERAIS LTDA. - SICOOB CENTRAL CREDIMINAS,0,-
4174720,COOPERATIVA DE CRÉDITO SICOOB COOPEMAR LTDA,0,-
19086249,EXECUTIVE CORRETORA DE CÂMBIO LTDA.,0,-
15761217,CORRETORA DE CÂMBIO AÇORIANA LIMITADA.,0,-
81014060,COOPERATIVA DE CREDITO DE LIVRE ADMISSÃO DE ASSOCIADOS ITAIPU SICOOB CREDITAIPU,0,-
15168152,CONSEGTUR CORRETORA DE CÂMBIO LTDA.,0,-
92236777,PINE INVESTIMENTOS DISTRIBUIDORA DE TÍTULOS E VALORES MOBILIÁRIOS LTDA,0,-
33851064,DILLON S/A DISTRIBUIDORA DE TITULOS E VALORES MOBILIARIOS,0,-
34666362,MONOPÓLIO CORRETORA DE CÂMBIO LTDA.,0,-
17508380,INVEST CORRETORA DE CÂMBIO LTDA.,0,-
17635177,CONEXION CORRETORA DE CÂMBIO LTDA.,0,-
9424988,COOPERATIVA DE CRÉDITO DE LIVRE ADMISSÃO DO OESTE MARANHENSE - SICOOB OESTE MARANHENSE,0,-
32062580,BANCO CREDIT SUISSE (BRASIL) S.A.,0,-
62280490,DIBRAN DISTRIBUIDORA DE TÍTULOS E VALORES MOBILIÁRIOS LTDA.,0,-
10853017,GET MONEY CORRETORA DE CÂMBIO S.A.,0,-
11907520,COOPERATIVA DE CRÉDITO DE LIVRE ADMISSÃO DA PARAÍBA - SICOOB PARAÍBA,0,-
4866275,BANCO INBURSA S.A.,0,-
5861932,COOPERATIVA DE CRÉDITO MÚTUO DOS ADVOGADOS DE SANTA CATARINA,0,-
61033106,BANCO CREFISA S.A.,0,-
4684647,"ARC CORRETORA DE CAMBIO, ASSOCIADOS GOUVEIA, CAMPEDELLI S.A.",0,-
2883398,COOPERATIVA DE CRÉDITO DO VALE DO ITAJAÍ E VALE DO ITAPOCÚ - SICOOB MULTICREDI,0,-
31597552,BANCO CLASSICO S.A.,0,-
1709266,COOPERATIVA DE CRÉDITO MÚTUO DOS PROFISSIONAIS DA SAÚDE E LIVRE ADMISSÃO DE TEÓFILO OTONI LTDA. - UNICRED TRÊS VALES,0,-
8253539,COOPERATIVA DE CRÉDITO RURAL DE SÃO MIGUEL DO OESTE - SULCREDI/SÃO MIGUEL,0,-
31895683,BANCO INDUSTRIAL DO BRASIL S.A.,0,-
74114042,COOPERATIVA DE CRÉDITO UNICRED UNIÃO LTDA - UNICRED UNIÃO,0,-
47074323,SICOOB CREDICONSUMO - COOPERATIVA DE CRÉDITO,0,-
22760839,COOPERATIVA DE CRÉDITO NOSSOCRÉDITO LTDA - SICOOB NOSSOCRÉDITO,0,-
65229254,COOPERATIVA DE CRÉDITO COOPACREDI LTDA. - SICOOB COOPACREDI,0,-
71698674,SICOOB UNIMAIS MANTIQUEIRA - COOPERATIVA DE CRÉDITO DE LIVRE ADMISSÃO,0,-
25395435,COOPERATIVA DE CRÉDITO CREDICAF LTDA - SICOOB CREDICAF,0,-
9526594,BANCO MASTER DE INVESTIMENTO S.A.,0,-
20155248,PARMETAL DISTRIBUIDORA DE TÍTULOS E VALORES MOBILIÁRIOS LTDA,0,-
21661202,COOPERATIVA DE CRÉDITO CREDICAMPO LTDA.- SICOOB CREDICAMPO,0,-
12599971,"CREDITÁ S/A CRÉDITO, FINANCIAMENTO E INVESTIMENTO",0,-
18520834,UBS BRASIL BANCO DE INVESTIMENTO S.A.,0,-
25536764,COOPERATIVA DE CRÉDITO CREDILUZ LTDA. - SICOOB CREDILUZ,0,-
17772370,VIP'S CORRETORA DE CÂMBIO LTDA.,0,-
42584318,CREDIT SUISSE (BRASIL) S.A. CORRETORA DE TÍTULOS E VALORES MOBILIÁRIOS,0,-
71677850,FRENTE CORRETORA DE CÂMBIO S.A.,0,-
33987793,BANCO DE INVESTIMENTOS CREDIT SUISSE (BRASIL) S.A.,0,-
184068,COOPERATIVA DE CRÉDITO UNICRED CENTRAL MULTIRREGIONAL LTDA. - UCM,0,-
65239402,COOPERATIVA DE CRÉDITO UNIÃO DO CENTRO OESTE DE MINAS LTDA. - SICOOB CENTRO UNIÃO,0,-
41753500,COOPERATIVA DE CRÉDITO CARLOS CHAGAS LTDA. - SICOOB CARLOS CHAGAS,0,-
15213150,BOCOM BBM CORRETORA DE CÂMBIO E VALORES MOBILIÁRIOS S.A.,0,-
1760242,COOPERATIVA DE CRÉDITO DE LIVRE ADMISSÃO DE BELO HORIZONTE E CIDADES POLO DO ESTADO DE MINAS GERAIS LTDA. - SICOOB NOSSACOOP,0,-
67096909,COOPERATIVA DE CRÉDITO CREDICOCAPEC,0,-
2347114,GREENCRED - COOPERATIVA DE CREDITO,0,-
2232383,COOPERATIVA DE CRÉDITO DE LIVRE ADMISSÃO DA REGIÃO DO CIRCUITO CAMPOS DAS VERTENTES LTDA - SICOOB COPERMEC,0,-
7599206,COOPERATIVA DE CRÉDITO DE LIVRE ADMISSÃO DA REGIÃO METROPOLITANA DE GOIÂNIA LTDA.,0,-
20251847,SUDACRED - SOCIEDADE DE CRÉDITO AO MICROEMPREENDEDOR E À EMPRESA DE PEQUENO PORTE LTDA.,0,-
15114366,BANCO BOCOM BBM S.A.,0,-
43774196,"AGROLEND SOCIEDADE DE CREDITO, FINANCIAMENTO E INVESTIMENTO S.A.",0,-
416968,BANCO INTER S.A.,0,-
4138455,COOPERATIVA DE CRÉDITO DO RIO GRANDE DO NORTE - SICOOB RIO GRANDE DO NORTE,0,-
14190547,CAMBIONET CORRETORA DE CÂMBIO LTDA.,0,-
4715685,COOPERATIVA DE CRÉDITO MÚTUO DOS DESPACHANTES DE TRÂNSITO DE SANTA CATARINA E RIO GRANDE DO SUL - SICOOB CREDITRAN,0,-
74064502,COOPERATIVA DE CRÉDITO UNICRED VALOR CAPITAL LTDA - UNICRED VALOR CAPITAL,0,-
1039011,COOPERATIVA DE CRÉDITO UNICRED DESBRAVADORA LTDA - UNICRED DESBRAVADORA,0,-
58616418,BANCO FIBRA S.A.,0,-
22753982,COOPERATIVA DE CRÉDITO CREDISETE LTDA. - SICOOB CREDISETE,0,-
22610500,VORTX DISTRIBUIDORA DE TITULOS E VALORES MOBILIARIOS LTDA.,0,-